TransactionNo,Date,ProductNo,ProductName,Price,Quantity,CustomerNo,Country
678,7/20/2021,22630,Dolly Girl Lunch Box,6.19,1,15492,United Kingdom
679,7/21/2021,22632,Hand Warmer Red Retrospot,6.19,1,15492,United Kingdom
680,7/22/2021,22633,Hand Warmer Union Jack,6.19,1,15492,United Kingdom
681,7/23/2021,22634,Childs Breakfast Set Spaceboy,6.19,1,15492,United Kingdom
682,7/24/2021,22650,Ceramic Pirate Chest Money Bank,6.19,2,15492,United Kingdom
683,7/25/2021,22651,Gentleman Shirt Repair Kit,6.19,1,15492,United Kingdom
684,7/26/2021,22653,Button Box,6.19,16,15492,United Kingdom
685,7/27/2021,22654,Deluxe Sewing Kit,6.19,2,15492,United Kingdom
686,7/28/2021,22659,Lunch Box I Love London,6.19,1,15492,United Kingdom
687,7/29/2021,22666,Recipe Box Pantry Yellow Design,6.19,5,15492,United Kingdom
688,7/30/2021,22693,Grow A Flytrap Or Sunflower In Tin,6.19,3,15492,United Kingdom
689,7/31/2021,22694,Wicker Star,6.19,1,15492,United Kingdom
690,8/1/2021,22697,Green Regency Teacup And Saucer,6.19,1,15492,United Kingdom
691,8/2/2021,22699,Roses Regency Teacup And Saucer,6.19,2,15492,United Kingdom
692,8/3/2021,22701,Pink Dog Bowl,6.19,5,15492,United Kingdom
693,8/4/2021,22703,Pink Cat Bowl,6.19,6,15492,United Kingdom
694,8/5/2021,22712,Card Dolly Girl,6.19,1,15492,United Kingdom
695,8/6/2021,22713,Card I Love London,6.19,1,15492,United Kingdom
696,8/7/2021,22714,Card Birthday Cowboy,6.19,2,15492,United Kingdom
697,8/8/2021,22716,Card Circus Parade,6.19,3,15492,United Kingdom
698,8/9/2021,22717,Card Dog And Ball,6.19,1,15492,United Kingdom
699,8/10/2021,22720,Set Of 3 Cake Tins Pantry Design,6.19,2,15492,United Kingdom
700,8/11/2021,22725,Alarm Clock Bakelike Chocolate,6.19,1,15492,United Kingdom
701,8/12/2021,22726,Alarm Clock Bakelike Green,6.19,4,15492,United Kingdom
702,8/13/2021,22727,Alarm Clock Bakelike Red,6.19,4,15492,United Kingdom
703,8/14/2021,22730,Alarm Clock Bakelike Ivory,6.19,1,15492,United Kingdom
704,8/15/2021,22741,Funky Diva Pen,6.19,4,15492,United Kingdom
705,8/16/2021,22745,Poppy's Playhouse Bedroom,6.19,2,15492,United Kingdom
706,8/17/2021,22748,Poppy's Playhouse Kitchen,6.19,1,15492,United Kingdom
707,8/18/2021,22749,Feltcraft Princess Charlotte Doll,6.19,1,15492,United Kingdom
708,8/19/2021,22751,Feltcraft Princess Olivia Doll,6.19,2,15492,United Kingdom
709,8/20/2021,22753,Small Yellow Babushka Notebook,6.19,1,15492,United Kingdom
710,8/21/2021,22754,Small Red Babushka Notebook,6.19,1,15492,United Kingdom
711,8/22/2021,22757,Large Red Babushka Notebook,6.19,3,15492,United Kingdom
712,8/23/2021,22758,Large Purple Babushka Notebook,6.19,2,15492,United Kingdom
713,8/24/2021,22763,Key Cabinet Ma Campagne,6.19,1,15492,United Kingdom
714,8/25/2021,22768,Family Photo Frame Cornice,6.19,2,15492,United Kingdom
715,8/26/2021,22776,Sweetheart 3 Tier Cake Stand,6.19,1,15492,United Kingdom
716,8/27/2021,22795,Sweetheart Recipe Book Stand,6.19,1,15492,United Kingdom
717,8/28/2021,22798,Antique Glass Dressing Table Pot,6.19,3,15492,United Kingdom
718,8/29/2021,22800,Antique Tall Swirlglass Trinket Pot,6.19,3,15492,United Kingdom
719,8/30/2021,22809,Set Of 6 T-Lights Santa,6.19,1,15492,United Kingdom
720,8/31/2021,22811,Set Of 6 T-Lights Cacti,6.19,1,15492,United Kingdom
721,9/1/2021,22814,Card Party Games,6.19,9,15492,United Kingdom
722,9/2/2021,22815,Card Psychedelic Apples,6.19,18,15492,United Kingdom
723,9/3/2021,22816,Card Motorbike Santa,6.19,2,15492,United Kingdom
724,9/4/2021,22817,Card Suki Birthday,6.19,5,15492,United Kingdom
725,9/5/2021,22818,Card Christmas Village,7.24,6,15492,United Kingdom
726,9/6/2021,22819,Birthday Card Retro Spot,7.24,3,15492,United Kingdom
727,9/7/2021,22835,Hot Water Bottle I Am So Poorly,7.24,3,15492,United Kingdom
728,9/8/2021,22865,Hand Warmer Owl Design,7.24,2,15492,United Kingdom
729,9/9/2021,22866,Hand Warmer Scotty Dog Design,7.24,3,15492,United Kingdom
730,9/10/2021,22867,Hand Warmer Bird Design,7.24,4,15492,United Kingdom
731,9/11/2021,22881,Number Tile Vintage Font 2,7.24,1,15492,United Kingdom
732,9/12/2021,22885,Number Tile Vintage Font 6,7.24,1,15492,United Kingdom
733,9/13/2021,22888,Number Tile Vintage Font 9,7.24,1,15492,United Kingdom
734,9/14/2021,22890,Novelty Biscuits Cake Stand 3 Tier,7.24,1,15492,United Kingdom
735,9/15/2021,22898,Childrens Apron Apples Design,7.24,1,15492,United Kingdom
736,9/16/2021,22899,Children's Apron Dolly Girl,7.24,2,15492,United Kingdom
737,9/17/2021,22900,Set 2 Tea Towels I Love London,7.24,3,15492,United Kingdom
738,9/18/2021,22905,Calendar In Season Design,7.24,1,15492,United Kingdom
739,9/19/2021,22907,Pack Of 20 Napkins Pantry Design,6.39,1,15492,United Kingdom
740,9/20/2021,22909,Set Of 20 Vintage Christmas Napkins,7.24,5,15492,United Kingdom
741,9/21/2021,22910,Paper Chain Kit Vintage Christmas,7.24,7,15492,United Kingdom
742,9/22/2021,22914,Blue Coat Rack Paris Fashion,7.24,1,15492,United Kingdom
743,9/23/2021,22922,Fridge Magnets Us Diner Assorted,7.24,6,15492,United Kingdom
744,9/24/2021,22924,Fridge Magnets La Vie En Rose,7.24,6,15492,United Kingdom
745,9/25/2021,22928,Yellow Giant Garden Thermometer,7.24,1,15492,United Kingdom
746,9/26/2021,22940,Feltcraft Christmas Fairy,6.19,1,15492,United Kingdom
747,9/27/2021,22941,Christmas Lights 10 Reindeer,6.19,2,15492,United Kingdom
748,9/28/2021,22943,Christmas Lights 10 Vintage Baubles,6.19,1,15492,United Kingdom
749,9/29/2021,22948,Metal Decoration Naughty Children,6.19,4,15492,United Kingdom
750,9/30/2021,22951,60 Cake Cases Dolly Girl Design,6.19,2,15492,United Kingdom
751,10/1/2021,22952,60 Cake Cases Vintage Christmas,6.19,2,15492,United Kingdom
752,10/2/2021,22955,36 Foil Star Cake Cases,6.19,1,15492,United Kingdom
753,10/3/2021,22960,Jam Making Set With Jars,6.19,2,15492,United Kingdom
754,10/4/2021,22961,Jam Making Set Printed,6.19,9,15492,United Kingdom
755,10/5/2021,22962,Jam Jar With Pink Lid,6.19,3,15492,United Kingdom
756,10/6/2021,22963,Jam Jar With Green Lid,6.19,3,15492,United Kingdom
757,10/7/2021,22964,3 Piece Spaceboy Cookie Cutter Set,6.19,1,15492,United Kingdom
758,10/8/2021,22965,3 Traditional Biscuit Cutters Set,6.19,1,15492,United Kingdom
759,10/9/2021,22966,Gingerbread Man Cookie Cutter,6.19,4,15492,United Kingdom
760,10/10/2021,22969,Homemade Jam Scented Candles,6.19,6,15492,United Kingdom
761,10/11/2021,22975,Spaceboy Childrens Egg Cup,6.19,2,15492,United Kingdom
762,10/12/2021,22976,Circus Parade Childrens Egg Cup,6.19,1,15492,United Kingdom
763,10/13/2021,22977,Dolly Girl Childrens Egg Cup,6.19,1,15492,United Kingdom
764,10/14/2021,22979,Pantry Washing Up Brush,6.19,2,15492,United Kingdom
765,10/15/2021,22980,Pantry Scrubbing Brush,6.19,1,15492,United Kingdom
766,10/16/2021,22982,Pantry Pastry Brush,6.19,3,15492,United Kingdom
767,10/17/2021,22983,Card Billboard Font,6.19,1,15492,United Kingdom
768,10/18/2021,22984,Card Gingham Rose,6.19,1,15492,United Kingdom
769,10/19/2021,22988,Soldiers Egg Cup,6.19,1,15492,United Kingdom
770,10/20/2021,22989,Set 2 Pantry Design Tea Towels,6.19,2,15492,United Kingdom
771,10/21/2021,22992,Revolver Wooden Ruler,6.19,3,15492,United Kingdom
772,10/22/2021,22993,Set Of 4 Pantry Jelly Moulds,6.19,3,15492,United Kingdom
773,10/23/2021,22995,Travel Card Wallet Suki,6.19,4,15492,United Kingdom
774,10/24/2021,22996,Travel Card Wallet Vintage Ticket,6.19,5,15492,United Kingdom
775,10/25/2021,22997,Travel Card Wallet Union Jack,6.19,1,15492,United Kingdom
776,10/26/2021,22998,Travel Card Wallet Keep Calm,6.19,4,15492,United Kingdom
777,10/27/2021,22999,Travel Card Wallet Vintage Leaf,6.19,1,15492,United Kingdom
778,10/28/2021,23005,Travel Card Wallet I Love London,6.19,4,15492,United Kingdom
779,10/29/2021,23007,Spaceboy Baby Gift Set,6.19,1,15492,United Kingdom
780,10/30/2021,23009,I Love London Baby Gift Set,6.19,2,15492,United Kingdom
781,10/31/2021,23012,Glass Apothecary Bottle Perfume,6.19,1,15492,United Kingdom
782,11/1/2021,23013,Glass Apothecary Bottle Tonic,6.19,2,15492,United Kingdom
783,11/2/2021,23014,Glass Apothecary Bottle Elixir,6.19,1,15492,United Kingdom
784,11/3/2021,23050,Recycled Acapulco Mat Green,6.19,1,15492,United Kingdom
785,11/4/2021,23051,Recycled Acapulco Mat Blue,6.19,1,15492,United Kingdom
786,11/5/2021,23052,Recycled Acapulco Mat Turquoise,6.19,5,15492,United Kingdom
787,11/6/2021,23053,Recycled Acapulco Mat Pink,6.19,1,15492,United Kingdom
788,11/7/2021,23054,Recycled Acapulco Mat Lavender,6.19,1,15492,United Kingdom
789,11/8/2021,23074,Embossed Heart Trinket Box,6.19,1,15492,United Kingdom
790,11/9/2021,23076,Ice Cream Sundae Lip Gloss,6.19,3,15492,United Kingdom
791,11/10/2021,23077,Doughnut Lip Gloss,6.19,3,15492,United Kingdom
792,11/11/2021,23082,Set 6 Paper Table Lantern Hearts,6.19,1,15492,United Kingdom
793,11/12/2021,23083,Set 6 Paper Table Lantern Stars,6.19,1,15492,United Kingdom
794,11/13/2021,23084,Rabbit Night Light,6.19,57,15492,United Kingdom
795,11/14/2021,23088,Zinc Heart Flower T-Light Holder,6.19,1,15492,United Kingdom
796,11/15/2021,23089,Glass Bon Bon Jar,6.19,4,15492,United Kingdom
797,11/16/2021,23093,Small Parisienne Heart Photo Frame,6.19,3,15492,United Kingdom
798,11/17/2021,23103,Jingle Bell Heart Decoration,6.19,2,15492,United Kingdom
799,11/18/2021,23110,Parisienne Key Cabinet,6.19,1,15492,United Kingdom
800,11/19/2021,23111,Parisienne Sewing Box,6.19,1,15492,United Kingdom
801,11/20/2021,23112,Parisienne Curio Cabinet,6.19,1,15492,United Kingdom
802,11/21/2021,23118,Parisienne Jewellery Drawer,6.19,1,15492,United Kingdom
803,11/22/2021,23158,Set Of 5 Lucky Cat Magnets,6.19,1,15492,United Kingdom
804,11/23/2021,23165,Large Ceramic Top Storage Jar,6.19,2,15492,United Kingdom
805,11/24/2021,23166,Medium Ceramic Top Storage Jar,6.19,2,15492,United Kingdom
806,11/25/2021,23168,Classic Cafe Sugar Dispenser,6.19,2,15492,United Kingdom
807,11/26/2021,23171,Regency Tea Plate Green,6.19,1,15492,United Kingdom
808,11/27/2021,23172,Regency Tea Plate Pink,6.19,1,15492,United Kingdom
809,11/28/2021,23173,Regency Teapot Roses,6.19,1,15492,United Kingdom
810,11/29/2021,23175,Regency Milk Jug Pink,6.19,1,15492,United Kingdom
811,11/30/2021,23177,Treasure Island Book Box,6.19,1,15492,United Kingdom
812,12/1/2021,23183,Mother's Kitchen Spoon Rest,6.19,3,15492,United Kingdom
813,12/2/2021,23184,Bull Dog Bottle Opener,6.19,2,15492,United Kingdom
814,12/3/2021,23188,Vintage 2 Metre Folding Ruler,6.19,1,15492,United Kingdom
815,12/4/2021,23191,Bundle Of 3 Retro Note Books,6.19,1,15492,United Kingdom
816,12/5/2021,23194,Gymkhana Treasure Book Box,6.19,1,15492,United Kingdom
817,12/6/2021,23196,Vintage Leaf Magnetic Notepad,6.19,1,15492,United Kingdom
818,12/7/2021,23197,Sketchbook Magnetic Shopping List,6.19,2,15492,United Kingdom
819,12/8/2021,23198,Pantry Magnetic Shopping List,6.19,2,15492,United Kingdom
820,12/9/2021,23204,Charlotte Bag Apples Design,6.19,6,15492,United Kingdom
821,12/10/2021,23205,Charlotte Bag Vintage Alphabet,6.19,3,15492,United Kingdom
822,12/11/2021,23212,Heart Wreath Decoration With Bell,6.19,7,15492,United Kingdom
823,12/12/2021,23213,Star Wreath Decoration With Bell,6.19,7,15492,United Kingdom
824,12/13/2021,23220,Reindeer Heart Decoration Gold,6.19,2,15492,United Kingdom
825,12/14/2021,23224,Cherub Heart Decoration Gold,6.19,1,15492,United Kingdom
826,12/15/2021,23229,Vintage Donkey Tail Game,6.19,2,15492,United Kingdom
827,12/16/2021,23234,Biscuit Tin Vintage Christmas,6.19,4,15492,United Kingdom
828,12/17/2021,23241,Treasure Tin Gymkhana Design,6.19,3,15492,United Kingdom
829,12/18/2021,23243,Set Of Tea Coffee Sugar Tins Pantry,6.19,1,15492,United Kingdom
830,12/19/2021,23245,Set Of 3 Regency Cake Tins,6.19,7,15492,United Kingdom
831,12/20/2021,23247,Biscuit Tin 50'S Christmas,6.19,3,15492,United Kingdom
832,12/21/2021,23264,Set Of 3 Wooden Sleigh Decorations,6.19,3,15492,United Kingdom
833,12/22/2021,23265,Set Of 3 Wooden Tree Decorations,6.19,3,15492,United Kingdom
834,12/23/2021,23266,Set Of 3 Wooden Stocking Decoration,6.19,2,15492,United Kingdom
835,12/24/2021,23274,Star T-Light Holder Willie Winkie,6.19,3,15492,United Kingdom
836,12/25/2021,23275,Set Of 3 Hanging Owls Ollie Beak,6.19,2,15492,United Kingdom
837,12/26/2021,23280,Folding Butterfly Mirror Hot Pink,6.19,2,15492,United Kingdom
838,12/27/2021,23284,Doormat Keep Calm And Come In,6.19,1,15492,United Kingdom
839,12/28/2021,23285,Pink Vintage Spot Beaker,6.19,1,15492,United Kingdom
840,12/29/2021,23287,Red Vintage Spot Beaker,6.19,1,15492,United Kingdom
841,12/30/2021,23290,Spaceboy Childrens Bowl,6.19,1,15492,United Kingdom
842,12/31/2021,23292,Spaceboy Childrens Cup,6.19,1,15492,United Kingdom
843,1/1/2022,23293,Set Of 12 Fairy Cake Baking Cases,6.19,3,15492,United Kingdom
844,1/2/2022,23294,Set Of 6 Snack Loaf Baking Cases,6.19,1,15492,United Kingdom
845,1/3/2022,23295,Set Of 12 Mini Loaf Baking Cases,6.19,4,15492,United Kingdom
846,1/4/2022,23298,Spotty Bunting,6.19,2,15492,United Kingdom
847,1/5/2022,23299,Food Cover With Beads Set 2,6.19,1,15492,United Kingdom
848,1/6/2022,23300,Gardeners Kneeling Pad Cup Of Tea,6.19,3,15492,United Kingdom
849,1/7/2022,23301,Gardeners Kneeling Pad Keep Calm,6.19,6,15492,United Kingdom
850,1/8/2022,23307,Set Of 60 Pantry Design Cake Cases,6.19,7,15492,United Kingdom
851,1/9/2022,23308,Set Of 60 Vintage Leaf Cake Cases,6.19,1,15492,United Kingdom
852,1/10/2022,23309,Set Of 60 I Love London Cake Cases,6.19,2,15492,United Kingdom
853,1/11/2022,23310,Bubblegum Ring Assorted,6.19,4,15492,United Kingdom
854,1/12/2022,23311,Vintage Christmas Stocking,6.19,1,15492,United Kingdom
855,1/13/2022,23312,Vintage Christmas Gift Sack,6.19,6,15492,United Kingdom
856,1/14/2022,23313,Vintage Christmas Bunting,6.19,4,15492,United Kingdom
857,1/15/2022,23314,Vintage Christmas Tablecloth,6.19,1,15492,United Kingdom
858,1/16/2022,23319,Box Of 6 Mini 50'S Crackers,6.19,3,15492,United Kingdom
859,1/17/2022,23322,Large White Heart Of Wicker,6.19,1,15492,United Kingdom
860,1/18/2022,23323,White Wicker Star,6.19,6,15492,United Kingdom
861,1/19/2022,23328,Set 6 School Milk Bottles In Crate,6.19,5,15492,United Kingdom
862,1/20/2022,23332,Ivory Wicker Heart Large,6.19,1,15492,United Kingdom
863,1/21/2022,23334,Ivory Wicker Heart Small,6.19,1,15492,United Kingdom
864,1/22/2022,23336,Egg Frying Pan Pink,6.19,1,15492,United Kingdom
865,1/23/2022,23340,Vintage Christmas Cake Frill,6.19,3,15492,United Kingdom
866,1/24/2022,23345,Dolly Girl Beaker,6.19,1,15492,United Kingdom
867,1/25/2022,23347,I Love London Beaker,6.19,1,15492,United Kingdom
868,1/26/2022,23349,Roll Wrap Vintage Christmas,6.19,2,15492,United Kingdom
869,1/27/2022,23351,Roll Wrap 50'S Christmas,6.19,5,15492,United Kingdom
870,1/28/2022,23352,Roll Wrap 50'S Red Christmas,6.19,1,15492,United Kingdom
871,1/29/2022,23353,6 Gift Tags Vintage Christmas,6.19,3,15492,United Kingdom
872,1/30/2022,23354,6 Gift Tags 50'S Christmas,6.19,4,15492,United Kingdom
873,1/31/2022,23357,Hot Water Bottle Sex Bomb,6.19,1,15492,United Kingdom
874,2/1/2022,23358,Hot Stuff Hot Water Bottle,6.19,1,15492,United Kingdom
875,2/2/2022,23365,Set 12 Colour Pencils Love London,6.19,1,15492,United Kingdom
876,2/3/2022,23366,Set 12 Colouring Pencils Doily,6.04,5,15492,United Kingdom
877,2/4/2022,23367,Set 12 Colour Pencils Spaceboy,6.04,10,15492,United Kingdom
878,2/5/2022,23368,Set 12 Colour Pencils Dolly Girl,6.19,2,15492,United Kingdom
879,2/6/2022,23581,Jumbo Bag Paisley Park,6.19,3,15492,United Kingdom
880,2/7/2022,21928,Jumbo Bag Scandinavian Blue Paisley,6.19,2,15492,United Kingdom
881,2/8/2022,21929,Jumbo Bag Pink Vintage Paisley,6.19,1,15492,United Kingdom
882,2/9/2022,85099C,Jumbo Bag Baroque Black White,6.19,7,15492,United Kingdom
883,2/10/2022,23199,Jumbo Bag Apples,6.19,2,15492,United Kingdom
884,2/11/2022,23200,Jumbo Bag Pears,6.19,1,15492,United Kingdom
885,2/12/2022,23202,Jumbo Bag Vintage Leaf,6.19,2,15492,United Kingdom
886,2/13/2022,23343,Jumbo Bag Vintage Christmas,6.19,4,15492,United Kingdom
887,2/14/2022,23344,Jumbo Bag 50'S Christmas,6.19,5,15492,United Kingdom
888,2/15/2022,23583,Lunch Bag Paisley Park,6.19,2,15492,United Kingdom
889,2/16/2022,20727,Lunch Bag Black Skull,6.04,2,15492,United Kingdom
890,2/17/2022,20728,Lunch Bag Cars Blue,6.04,1,15492,United Kingdom
891,2/18/2022,20725,Lunch Bag Red Retrospot,6.19,1,15492,United Kingdom
892,2/19/2022,20726,Lunch Bag Woodland,6.19,1,15492,United Kingdom
893,2/20/2022,22662,Lunch Bag Dolly Girl Design,6.19,1,15492,United Kingdom
894,2/21/2022,23206,Lunch Bag Apple Design,6.19,3,15492,United Kingdom
895,2/22/2022,23208,Lunch Bag Vintage Leaf Design,6.19,3,15492,United Kingdom
896,2/23/2022,23375,50'S Christmas Paper Gift Bag,6.19,1,15492,United Kingdom
897,2/24/2022,23437,50'S Christmas Gift Bag Large,6.19,1,15492,United Kingdom
898,2/25/2022,22821,Gift Bag Psychedelic Apples,7.24,3,15492,United Kingdom
899,2/26/2022,79190B,Retro Plastic Polka Tray,7.24,15,12423,Belgium
900,2/27/2022,79190A,Retro Plastic 70'S Tray,7.24,15,12423,Belgium
901,2/28/2022,22915,Assorted Bottle Top Magnets,7.24,12,12423,Belgium
902,3/1/2022,22151,Place Setting White Heart,7.24,24,12423,Belgium
903,3/2/2022,22632,Hand Warmer Red Retrospot,7.24,12,12423,Belgium
904,3/3/2022,22865,Hand Warmer Owl Design,7.24,12,12423,Belgium
905,3/4/2022,20718,Red Retrospot Shopper Bag,7.24,10,12423,Belgium
906,3/5/2022,79190B,Retro Plastic Polka Tray,7.24,12,12423,Belgium
907,3/6/2022,71459,Hanging Jam Jar T-Light Holders,7.24,12,12423,Belgium
908,3/7/2022,84945,Multi Colour Silver T-Light Holder,7.24,12,12423,Belgium
909,3/8/2022,22356,Charlotte Bag Pink Polkadot,7.24,10,12423,Belgium
910,3/9/2022,20724,Red Retrospot Charlotte Bag,7.24,10,12423,Belgium
911,3/10/2022,23204,Charlotte Bag Apples Design,7.24,10,12423,Belgium
912,3/11/2022,21108,Fairy Cake Flannel Assorted Colour,7.24,18,12423,Belgium
913,3/12/2022,22252,Birdcage Decoration Tealight Holder,7.24,12,12423,Belgium
914,3/13/2022,22807,Set Of 6 T-Lights Toadstools,6.19,6,12423,Belgium
915,3/14/2022,23084,Rabbit Night Light,6.19,24,12518,Germany
916,3/15/2022,21559,Strawberry Lunch Box With Cutlery,6.19,6,12518,Germany
917,3/16/2022,21506,Fancy Font Birthday Card,6.19,12,12518,Germany
918,3/17/2022,22716,Card Circus Parade,6.19,12,12518,Germany
919,3/18/2022,22556,Plasters In Tin Circus Parade,6.19,12,12518,Germany
920,3/19/2022,22328,Round Snack Boxes Set Of 4 Fruits,6.19,6,12518,Germany
921,3/20/2022,22730,Alarm Clock Bakelike Ivory,6.19,4,12518,Germany
922,3/21/2022,22633,Hand Warmer Union Jack,6.19,12,12518,Germany
923,3/22/2022,22326,Round Snack Boxes Set Of4 Woodland,6.19,6,12518,Germany
924,3/23/2022,10125,Mini Funky Design Tapes,6.19,20,12518,Germany
925,3/24/2022,23367,Set 12 Colour Pencils Spaceboy,6.19,24,12518,Germany
926,3/25/2022,22551,Plasters In Tin Spaceboy,6.04,12,12518,Germany
927,3/26/2022,22554,Plasters In Tin Woodland Animals,6.04,12,12518,Germany
928,3/27/2022,22549,Picture Dominoes,6.19,12,12518,Germany
929,3/28/2022,23388,Woodland Mini Backpack,6.19,4,12518,Germany
930,3/29/2022,23390,Dolly Girl Mini Backpack,6.19,4,12518,Germany
931,3/30/2022,23389,Spaceboy Mini Backpack,6.19,4,12518,Germany
932,3/31/2022,23535,Wall Art Bicycle Safety,6.19,12,14051,United Kingdom
933,4/1/2022,22699,Roses Regency Teacup And Saucer,6.19,12,14051,United Kingdom
934,4/2/2022,22698,Pink Regency Teacup And Saucer,6.19,12,14051,United Kingdom
935,4/3/2022,22697,Green Regency Teacup And Saucer,6.19,12,14051,United Kingdom
936,4/4/2022,22633,Hand Warmer Union Jack,6.04,18,14051,United Kingdom
937,4/5/2022,15056N,Edwardian Parasol Natural,6.19,36,14051,United Kingdom
938,4/6/2022,23439,Hand Warmer Red Love Heart,6.19,36,14051,United Kingdom
939,4/7/2022,48138,Doormat Union Flag,6.19,10,14051,United Kingdom
940,4/8/2022,21523,Doormat Fancy Font Home Sweet Home,6.19,10,14051,United Kingdom
941,4/9/2022,21877,Home Sweet Home Mug,6.19,12,14051,United Kingdom
942,4/10/2022,21871,Save The Planet Mug,6.19,18,14051,United Kingdom
943,4/11/2022,22798,Antique Glass Dressing Table Pot,6.19,36,14051,United Kingdom
944,4/12/2022,23173,Regency Teapot Roses,6.19,6,14051,United Kingdom
945,4/13/2022,22423,Regency Cakestand 3 Tier,6.19,10,14051,United Kingdom
946,4/14/2022,22664,Toy Tidy Dolly Girl Design,6.19,20,16558,United Kingdom
947,4/15/2022,22721,Set Of 3 Cake Tins Sketchbook,6.19,12,16558,United Kingdom
948,4/16/2022,72800E,4 Ivory Dinner Candles Silver Flock,6.19,12,16558,United Kingdom
949,4/17/2022,23313,Vintage Christmas Bunting,6.19,10,16558,United Kingdom
950,4/18/2022,22952,60 Cake Cases Vintage Christmas,6.19,24,16558,United Kingdom
951,4/19/2022,22909,Set Of 20 Vintage Christmas Napkins,6.04,12,16558,United Kingdom
952,4/20/2022,23298,Spotty Bunting,6.19,3,16558,United Kingdom
953,4/21/2022,23598,Paper Bunting Vintage Party,6.19,6,16558,United Kingdom
954,4/22/2022,16169E,Wrap 50'S Christmas,6.19,25,16558,United Kingdom
955,4/23/2022,23351,Roll Wrap 50'S Christmas,6.19,12,16558,United Kingdom
956,4/24/2022,23350,Roll Wrap Vintage Spot,6.19,24,16558,United Kingdom
957,4/25/2022,22865,Hand Warmer Owl Design,6.19,24,16558,United Kingdom
958,4/26/2022,22632,Hand Warmer Red Retrospot,6.19,12,16558,United Kingdom
959,4/27/2022,22835,Hot Water Bottle I Am So Poorly,6.19,4,16558,United Kingdom
960,4/28/2022,22112,Chocolate Hot Water Bottle,6.19,6,16558,United Kingdom
961,4/29/2022,23355,Hot Water Bottle Keep Calm,6.19,4,16558,United Kingdom
962,4/30/2022,22314,Office Mug Warmer Choc+Blue,6.19,24,16558,United Kingdom
963,5/1/2022,22313,Office Mug Warmer Pink,6.19,12,16558,United Kingdom
964,5/2/2022,23084,Rabbit Night Light,6.19,18,16558,United Kingdom
965,5/3/2022,20831,Gold Photo Frame,6.19,12,16558,United Kingdom
966,5/4/2022,21115,Rose Caravan Doorstop,6.19,8,16558,United Kingdom
967,5/5/2022,21462,Nursery A B C Painted Letters,7.24,8,16558,United Kingdom
968,5/6/2022,22076,6 Ribbons Empire,7.24,24,16558,United Kingdom
969,5/7/2022,22190,Local Cafe Mug,7.24,24,16558,United Kingdom
970,5/8/2022,22215,Cake Stand White Two Tier Lace,7.24,6,16558,United Kingdom
971,5/9/2022,22220,Cake Stand Lovebird 2 Tier White,7.24,6,16558,United Kingdom
972,5/10/2022,22464,Hanging Metal Heart Lantern,7.24,12,16558,United Kingdom
973,5/11/2022,22465,Hanging Metal Star Lantern,7.24,12,16558,United Kingdom
974,5/12/2022,22539,Mini Jigsaw Dolly Girl,7.24,48,16558,United Kingdom
975,5/13/2022,22544,Mini Jigsaw Spaceboy,7.24,48,16558,United Kingdom
976,5/14/2022,23438,Red Spot Gift Bag Large,6.19,12,16558,United Kingdom
977,5/15/2022,23437,50'S Christmas Gift Bag Large,6.19,12,16558,United Kingdom
978,5/16/2022,20719,Woodland Charlotte Bag,6.19,33,17497,United Kingdom
979,5/17/2022,20723,Strawberry Charlotte Bag,6.19,42,17497,United Kingdom
980,5/18/2022,20724,Red Retrospot Charlotte Bag,6.19,55,17497,United Kingdom
981,5/19/2022,21212,Pack Of 72 Retrospot Cake Cases,7.24,7,17497,United Kingdom
982,5/20/2022,21238,Red Retrospot Cup,7.24,8,17497,United Kingdom
983,5/21/2022,21242,Red Retrospot Plate,7.24,2,17497,United Kingdom
984,5/22/2022,21479,White Skull Hot Water Bottle,7.24,25,17497,United Kingdom
985,5/23/2022,21481,Fawn Blue Hot Water Bottle,7.24,1,17497,United Kingdom
986,5/24/2022,21481,Fawn Blue Hot Water Bottle,7.24,1,17497,United Kingdom
987,5/25/2022,21484,Chick Grey Hot Water Bottle,7.24,1,17497,United Kingdom
988,5/26/2022,21668,Red Stripe Ceramic Drawer Knob,7.24,1,17497,United Kingdom
989,5/27/2022,21670,Blue Spot Ceramic Drawer Knob,7.24,1,17497,United Kingdom
990,5/28/2022,21671,Red Spot Ceramic Drawer Knob,7.24,1,17497,United Kingdom
991,5/29/2022,21672,White Spot Red Ceramic Drawer Knob,7.24,6,17497,United Kingdom
992,5/30/2022,21673,White Spot Blue Ceramic Drawer Knob,7.24,1,17497,United Kingdom
993,5/31/2022,21714,Citronella Candle Garden Pot,7.24,2,17497,United Kingdom
994,6/1/2022,22110,Bird House Hot Water Bottle,7.24,7,17497,United Kingdom
995,6/2/2022,22111,Scottie Dog Hot Water Bottle,7.24,5,17497,United Kingdom
996,6/3/2022,22112,Chocolate Hot Water Bottle,7.24,13,17497,United Kingdom
997,6/4/2022,22114,Hot Water Bottle Tea And Sympathy,7.24,48,17497,United Kingdom
998,6/5/2022,22197,Popcorn Holder,7.24,68,17497,United Kingdom
999,6/6/2022,22355,Charlotte Bag Suki Design,7.24,110,17497,United Kingdom
