TransactionNo,Date,ProductNo,ProductName,Price,Quantity,CustomerNo,Country
1,9/12/2019,22485,Set Of 2 Wooden Market Crates,21.47,12,17490,United Kingdom
2,9/13/2019,22596,Christmas Star Wish List Chalkboard,10.65,36,13069,United Kingdom
3,9/14/2019,23235,Storage Tin Vintage Leaf,11.53,12,13069,United Kingdom
4,9/15/2019,23272,Tree T-Light Holder Willie Winkie,10.65,12,13069,United Kingdom
5,9/16/2019,23239,Set Of 4 Knick Knack Tins Poppies,11.94,6,13069,United Kingdom
6,9/17/2019,21705,Bag 500g Swirly Marbles,10.65,24,13069,United Kingdom
7,9/18/2019,22118,Joy Wooden Block Letters,11.53,18,13069,United Kingdom
8,9/19/2019,22119,Peace Wooden Block Letters,12.25,12,13069,United Kingdom
9,9/20/2019,22217,T-Light Holder Hanging Lace,10.65,12,13069,United Kingdom
10,9/21/2019,22216,T-Light Holder White Lace,10.55,24,13069,United Kingdom
11,9/22/2019,22380,Toy Tidy Spaceboy,11.06,20,13069,United Kingdom
12,9/23/2019,22442,Grow Your Own Flowers Set Of 3,12.25,12,13069,United Kingdom
13,9/24/2019,22664,Toy Tidy Dolly Girl Design,11.06,20,13069,United Kingdom
14,9/25/2019,22721,Set Of 3 Cake Tins Sketchbook,12.25,12,13069,United Kingdom
15,9/26/2019,22723,Set Of 6 Herb Tins Sketchbook,11.53,12,13069,United Kingdom
16,9/27/2019,22785,Squarecushion Cover Pink Union Jack,11.53,12,13069,United Kingdom
17,9/28/2019,22955,36 Foil Star Cake Cases,11.06,24,13069,United Kingdom
18,9/29/2019,23141,Triple Wire Hook Pink Heart,11.06,12,13069,United Kingdom
19,9/30/2019,22956,36 Foil Heart Cake Cases,11.06,24,13069,United Kingdom
20,10/1/2019,22581,Wood Stocking Christmas Scandispot,10.55,48,13069,United Kingdom
21,10/2/2019,23198,Pantry Magnetic Shopping List,11.53,48,12433,Norway
22,10/3/2019,23197,Sketchbook Magnetic Shopping List,11.74,24,12433,Norway
23,10/4/2019,23184,Bull Dog Bottle Opener,15.32,8,12433,Norway
24,10/5/2019,23168,Classic Cafe Sugar Dispenser,11.53,12,12433,Norway
25,10/6/2019,23167,Small Ceramic Top Storage Jar,10.96,96,12433,Norway
26,10/7/2019,23166,Medium Ceramic Top Storage Jar,11.32,48,12433,Norway
27,10/8/2019,23165,Large Ceramic Top Storage Jar,11.74,48,12433,Norway
28,10/9/2019,23004,Travel Card Wallet Pantry,10.68,48,12433,Norway
29,10/10/2019,23002,Travel Card Wallet Skulls,10.68,24,12433,Norway
30,10/11/2019,23000,Travel Card Wallet Transport,10.68,24,12433,Norway
31,10/12/2019,22998,Travel Card Wallet Keep Calm,10.68,72,12433,Norway
32,10/13/2019,22994,Travel Card Wallet Retrospot,10.68,48,12433,Norway
33,10/14/2019,22835,Hot Water Bottle I Am So Poorly,15.32,8,12433,Norway
34,10/15/2019,22730,Alarm Clock Bakelike Ivory,14.09,4,12433,Norway
35,10/16/2019,22728,Alarm Clock Bakelike Pink,14.09,8,12433,Norway
36,10/17/2019,22727,Alarm Clock Bakelike Red,14.09,8,12433,Norway
37,10/18/2019,22726,Alarm Clock Bakelike Green,14.09,4,12433,Norway
38,10/19/2019,22720,Set Of 3 Cake Tins Pantry Design,14.61,16,12433,Norway
39,10/20/2019,22693,Grow A Flytrap Or Sunflower In Tin,11.34,192,12433,Norway
40,10/21/2019,22670,French Wc Sign Blue Metal,11.53,24,12433,Norway
41,10/22/2019,22667,Recipe Box Retrospot,12.86,24,12433,Norway
42,10/23/2019,22666,Recipe Box Pantry Yellow Design,12.86,24,12433,Norway
43,10/24/2019,22631,Circus Parade Lunch Box,12.25,12,12433,Norway
44,10/25/2019,22628,Picnic Boxes Set Of 3 Retrospot,15.32,16,12433,Norway
45,10/26/2019,22467,Gumball Coat Rack,12.86,6,12433,Norway
46,10/27/2019,22197,Popcorn Holder,10.99,100,12433,Norway
47,10/28/2019,22114,Hot Water Bottle Tea And Sympathy,14.61,8,12433,Norway
48,10/29/2019,22112,Chocolate Hot Water Bottle,15.32,9,12433,Norway
49,10/30/2019,21908,Chocolate This Way Metal Sign,12.4,36,12433,Norway
50,10/31/2019,21874,Gin And Tonic Mug,11.74,36,12433,Norway
51,11/1/2019,21872,Glamorous Mug,11.53,12,12433,Norway
52,11/2/2019,21871,Save The Planet Mug,11.74,36,12433,Norway
53,11/3/2019,21533,Retrospot Large Milk Jug,15.32,6,12433,Norway
54,11/4/2019,21481,Fawn Blue Hot Water Bottle,14.09,12,12433,Norway
55,11/5/2019,21479,White Skull Hot Water Bottle,14.61,4,12433,Norway
56,11/6/2019,21248,Door Hanger Mum + Dads Room,11.74,12,12433,Norway
57,11/7/2019,21216,Set 3 Retrospot Tea/Coffee/Sugar,14.61,24,12433,Norway
58,11/8/2019,21181,Please One Person Metal Sign,12.15,48,12433,Norway
59,11/9/2019,21175,Gin And Tonic Diet Metal Sign,12.38,48,12433,Norway
60,11/10/2019,21169,You're Confusing Me Metal Sign,11.74,48,12433,Norway
61,11/11/2019,21162,Toxic Area Door Hanger,10.65,24,12433,Norway
62,11/12/2019,21159,Moody Boy Door Hanger,10.65,24,12433,Norway
63,11/13/2019,21158,Moody Girl Door Hanger,10.65,24,12433,Norway
64,11/14/2019,21154,Red Retrospot Oven Glove,11.53,10,12433,Norway
65,11/15/2019,16016,Large Chinese Style Scissor,11.12,40,12433,Norway
66,11/16/2019,16014,Small Chinese Style Scissor,10.68,60,12433,Norway
67,11/17/2019,16008,Small Folding Scissor(Pointed Edge),10.37,240,12433,Norway
68,11/18/2019,85152,Hand Over The Chocolate Sign,12.15,48,12433,Norway
69,11/19/2019,84596F,Small Marshmallows Pink Bowl,10.68,32,12433,Norway
70,11/20/2019,84596B,Small Dolly Mix Design Orange Bowl,10.68,16,12433,Norway
71,11/21/2019,84510A,Set Of 4 English Rose Coasters,11.53,20,12433,Norway
72,11/22/2019,82600,N0 Singing Metal Sign,12.15,48,12433,Norway
73,11/23/2019,82581,Toilet Metal Sign,10.81,48,12433,Norway
74,11/24/2019,72232,Feng Shui Pillar Candle,10.44,144,12433,Norway
75,11/25/2019,47559B,Tea Time Oven Glove,11.53,10,12433,Norway
76,11/26/2019,47504H,English Rose Spirit Level,11.06,36,12433,Norway
77,11/27/2019,23493,Vintage Doily Travel Sewing Kit,12.25,30,12433,Norway
78,11/28/2019,23430,Blue Retro Kitchen Wall Clock,18.6,2,12433,Norway
79,11/29/2019,23429,Red Retro Kitchen Wall Clock,18.6,2,12433,Norway
80,11/30/2019,23428,Ivory Retro Kitchen Wall Clock,18.6,2,12433,Norway
81,12/1/2019,23358,Hot Stuff Hot Water Bottle,11.53,18,12433,Norway
82,12/2/2019,23293,Set Of 12 Fairy Cake Baking Cases,11.1,32,12433,Norway
83,12/3/2019,23243,Set Of Tea Coffee Sugar Tins Pantry,15.32,12,12433,Norway
84,12/4/2019,23240,Set Of 4 Knick Knack Tins Doily,14.5,6,12433,Norway
85,12/5/2019,48111,Doormat 3 Smiley Cats,17.51,10,13426,United Kingdom
86,12/6/2019,22464,Hanging Metal Heart Lantern,11.06,12,13426,United Kingdom
87,12/7/2019,20982,12 Pencils Tall Tube Skulls,11.12,12,13426,United Kingdom
88,12/8/2019,20981,12 Pencils Tall Tube Woodland,11.12,12,13426,United Kingdom
89,12/9/2019,23424,Gingham Recipe Book Box,15.32,8,13426,United Kingdom
90,12/10/2019,23338,Egg Frying Pan Red,12.15,48,13426,United Kingdom
91,12/11/2019,84970L,Single Heart Zinc T-Light Holder,11.53,12,13426,United Kingdom
92,12/12/2019,22457,Natural Slate Heart Chalkboard,13.27,6,13426,United Kingdom
93,12/13/2019,22469,Heart Of Wicker Small,11.94,12,13426,United Kingdom
94,12/14/2019,22909,Set Of 20 Vintage Christmas Napkins,11.12,12,13426,United Kingdom
95,12/15/2019,84947,Antique Silver Tea Glass Engraved,11.53,24,17364,United Kingdom
96,12/16/2019,23503,Playing Cards Keep Calm & Carry On,11.53,12,17364,United Kingdom
97,12/17/2019,23445,Ice Cream Bubbles,11.1,20,17364,United Kingdom
98,12/18/2019,23530,Wall Art Only One Person,15.32,12,17364,United Kingdom
99,12/19/2019,84997C,Childrens Cutlery Polkadot Blue,14.5,4,17364,United Kingdom
100,12/20/2019,84997D,Childrens Cutlery Polkadot Pink,14.5,4,17364,United Kingdom
101,12/21/2019,84077,World War 2 Gliders Asstd Designs,10.55,48,17364,United Kingdom
102,12/22/2019,22749,Feltcraft Princess Charlotte Doll,14.09,4,17364,United Kingdom
103,12/23/2019,23127,Feltcraft Girl Nicole Kit,15.32,4,17364,United Kingdom
104,12/24/2019,23126,Feltcraft Girl Amelie Kit,15.32,4,17364,United Kingdom
105,12/25/2019,22747,Poppy's Playhouse Bathroom,12.4,6,17364,United Kingdom
106,12/26/2019,22078,Ribbon Reel Lace Design,12.4,10,17364,United Kingdom
107,12/27/2019,84946,Antique Silver T-Light Glass,11.53,12,17364,United Kingdom
108,12/28/2019,22791,T-Light Glass Fluted Antique,11.53,12,17364,United Kingdom
109,12/29/2019,21326,Aged Glass Silver T-Light Holder,10.92,12,17364,United Kingdom
110,12/30/2019,22170,Picture Frame Wood Triple Portrait,17.17,8,17364,United Kingdom
111,12/31/2019,23082,Set 6 Paper Table Lantern Hearts,14.09,6,17364,United Kingdom
112,1/1/2020,22909,Set Of 20 Vintage Christmas Napkins,11.12,24,17364,United Kingdom
113,1/2/2020,22087,Paper Bunting White Lace,13.27,10,17364,United Kingdom
114,1/3/2020,23464,Vintage Zinc Watering Can Small,15.32,4,14441,United Kingdom
115,1/4/2020,22411,Jumbo Shopper Vintage Red Paisley,12.38,10,14441,United Kingdom
116,1/5/2020,84029E,Red Woolly Hottie White Heart,14.61,8,14441,United Kingdom
117,1/6/2020,22633,Hand Warmer Union Jack,12.4,12,14441,United Kingdom
118,1/7/2020,23355,Hot Water Bottle Keep Calm,15.32,12,14441,United Kingdom
119,1/8/2020,84029G,Knitted Union Flag Hot Water Bottle,14.61,12,14441,United Kingdom
120,1/9/2020,22112,Chocolate Hot Water Bottle,15.32,6,14441,United Kingdom
121,1/10/2020,84347,Rotating Silver Angels T-Light Hldr,12.86,18,14441,United Kingdom
122,1/11/2020,21115,Rose Caravan Doorstop,12.25,8,17490,United Kingdom
123,1/12/2020,22059,Ceramic Strawberry Design Mug,10.65,24,17490,United Kingdom
124,1/13/2020,22072,Red Retrospot Tea Cup And Saucer,11.53,24,17490,United Kingdom
125,1/14/2020,22123,Ping Microwave Apron,11.06,24,17490,United Kingdom
126,1/15/2020,22476,Empire Union Jack Tv Dinner Tray,12.25,8,17490,United Kingdom
127,1/16/2020,22495,Set Of 2 Round Tins Camembert,11.06,12,17490,United Kingdom
128,1/17/2020,22496,Set Of 2 Round Tins Dutch Cheese,11.06,12,17490,United Kingdom
129,1/18/2020,22513,Doorstop Football Design,11.06,8,17490,United Kingdom
130,1/19/2020,22500,Set Of 2 Tins Jardin De Provence,11.53,12,17490,United Kingdom
131,1/20/2020,22664,Toy Tidy Dolly Girl Design,11.06,20,17490,United Kingdom
132,1/21/2020,22721,Set Of 3 Cake Tins Sketchbook,12.25,12,17490,United Kingdom
133,1/22/2020,22785,Squarecushion Cover Pink Union Jack,11.53,12,17490,United Kingdom
134,1/23/2020,23178,Jam Clock Magnet,11.53,12,17490,United Kingdom
135,1/24/2020,23302,Kneeling Mat Housework Design,11.06,24,17490,United Kingdom
136,1/25/2020,23533,Wall Art Garden Haven,12.25,6,17490,United Kingdom
137,1/26/2020,84819,Danish Rose Round Sewing Box,11.06,16,17490,United Kingdom
138,1/27/2020,22371,Airline Bag Vintage Tokyo 78,14.3,12,17490,United Kingdom
139,1/28/2020,21875,Kings Choice Mug,11.34,36,17490,United Kingdom
140,1/29/2020,23251,Vintage Red Enamel Trim Mug,11.32,96,17490,United Kingdom
141,1/30/2020,23300,Gardeners Kneeling Pad Cup Of Tea,11.74,48,17490,United Kingdom
142,1/31/2020,22138,Baking Set 9 Piece Retrospot,14.61,24,17490,United Kingdom
143,2/1/2020,23843,Paper Craft Little Birdie,12.38,80995,16446,United Kingdom
144,2/2/2020,22617,Baking Set Spaceboy Design,15.32,18,17389,United Kingdom
145,2/3/2020,20749,Assorted Colour Mini Cases,16.76,84,17389,United Kingdom
146,2/4/2020,22910,Paper Chain Kit Vintage Christmas,13.27,12,17001,United Kingdom
147,2/5/2020,22086,Paper Chain Kit 50'S Christmas,13.27,12,17001,United Kingdom
148,2/6/2020,23351,Roll Wrap 50'S Christmas,6.19,12,17001,United Kingdom
149,2/7/2020,23352,Roll Wrap 50'S Red Christmas,6.19,12,17001,United Kingdom
150,2/8/2020,22727,Alarm Clock Bakelike Red,6.19,8,17001,United Kingdom
151,2/9/2020,22730,Alarm Clock Bakelike Ivory,6.19,4,17001,United Kingdom
152,2/10/2020,22491,Pack Of 12 Coloured Pencils,6.04,12,17001,United Kingdom
153,2/11/2020,22561,Wooden School Colouring Set,6.04,12,17001,United Kingdom
154,2/12/2020,22489,Pack Of 12 Traditional Crayons,6.04,24,17001,United Kingdom
155,2/13/2020,22560,Traditional Modelling Clay,6.04,24,17001,United Kingdom
156,2/14/2020,22139,Retrospot Tea Set Ceramic 11 Pc,6.04,6,17001,United Kingdom
157,2/15/2020,23344,Jumbo Bag 50'S Christmas,6.19,20,17001,United Kingdom
158,2/16/2020,23203,Jumbo Bag Vintage Doily,6.19,20,17001,United Kingdom
159,2/17/2020,85099B,Jumbo Bag Red Retrospot,6.19,10,17001,United Kingdom
160,2/18/2020,23201,Jumbo Bag Alphabet,6.19,20,17001,United Kingdom
161,2/19/2020,23207,Lunch Bag Alphabet Design,6.19,10,17001,United Kingdom
162,2/20/2020,21137,Black Record Cover Frame,6.04,120,15694,United Kingdom
163,2/21/2020,23118,Parisienne Jewellery Drawer,6.04,16,17428,United Kingdom
164,2/22/2020,23111,Parisienne Sewing Box,6.04,16,17428,United Kingdom
165,2/23/2020,22179,Set 10 Night Owl Lights,6.04,24,17428,United Kingdom
166,2/24/2020,22061,Large Cake Stand Hanging Strawbery,7.24,48,16954,United Kingdom
167,2/25/2020,22182,Cake Stand Victorian Filigree Small,7.24,24,16954,United Kingdom
168,2/26/2020,23571,Traditional Naughts & Crosses,7.24,12,12433,Norway
169,2/27/2020,23369,Set 36 Colour Pencils Love London,6.19,2,15492,United Kingdom
170,2/28/2020,23370,Set 36 Colouring Pencils Doily,6.19,2,15492,United Kingdom
171,2/29/2020,23371,Set 36 Colour Pencils Spaceboy,6.19,3,15492,United Kingdom
172,3/1/2020,23372,Set 36 Colour Pencils Dolly Girl,6.19,1,15492,United Kingdom
173,3/2/2020,23376,Pack Of 12 Vintage Christmas Tissue,6.19,3,15492,United Kingdom
174,3/3/2020,23377,Pack Of 12 Dolly Girl Tissues,6.19,6,15492,United Kingdom
175,3/4/2020,23378,Pack Of 12 50'S Christmas Tissues,6.19,9,15492,United Kingdom
176,3/5/2020,23379,Pack Of 12 Red Apple Tissues,6.19,4,15492,United Kingdom
177,3/6/2020,23380,Pack Of 12 Vintage Doily Tissues,6.19,3,15492,United Kingdom
178,3/7/2020,23381,Pack Of 12 Vintage Leaf Tissues,6.19,1,15492,United Kingdom
179,3/8/2020,23382,Box Of 6 Christmas Cake Decorations,6.19,4,15492,United Kingdom
180,3/9/2020,23391,I Love London Mini Backpack,6.19,2,15492,United Kingdom
181,3/10/2020,23392,Spaceboy Rocket Lolly Makers,6.19,2,15492,United Kingdom
182,3/11/2020,23399,Home Sweet Home Hanging Heart,6.19,4,15492,United Kingdom
183,3/12/2020,23405,Home Sweet Home 2 Drawer Cabinet,6.19,3,15492,United Kingdom
184,3/13/2020,23418,Lavender Toilette Bottle,6.19,1,15492,United Kingdom
185,3/14/2020,23426,Metal Sign Drop Your Pants,6.19,1,15492,United Kingdom
186,3/15/2020,23434,3 Raffia Ribbons 50'S Christmas,6.19,9,15492,United Kingdom
187,3/16/2020,23435,3 Raffia Ribbons Vintage Christmas,6.04,3,15492,United Kingdom
188,3/17/2020,23439,Hand Warmer Red Love Heart,6.19,1,15492,United Kingdom
189,3/18/2020,23451,Square Mini Portrait Frame,6.19,1,15492,United Kingdom
190,3/19/2020,23467,Vintage Zinc Planter,6.19,1,15492,United Kingdom
191,3/20/2020,23469,Card Holder Love Bird Small,6.19,3,15492,United Kingdom
192,3/21/2020,23480,Mini Lights Woodland Mushrooms,6.19,2,15492,United Kingdom
193,3/22/2020,23493,Vintage Doily Travel Sewing Kit,6.19,3,15492,United Kingdom
194,3/23/2020,23494,Vintage Doily Deluxe Sewing Kit,6.19,1,15492,United Kingdom
195,3/24/2020,23495,Set Of 3 Pantry Wooden Spoons,6.19,1,15492,United Kingdom
196,3/25/2020,23497,Classic Chrome Bicycle Bell,6.19,4,15492,United Kingdom
197,3/26/2020,23498,Classic Bicycle Clips,6.19,2,15492,United Kingdom
198,3/27/2020,23501,Key Ring Baseball Boot Union Jack,6.19,3,15492,United Kingdom
199,3/28/2020,23506,Mini Playing Cards Spaceboy,6.04,1,15492,United Kingdom
200,3/29/2020,23508,Mini Playing Cards Dolly Girl,6.04,2,15492,United Kingdom
201,3/30/2020,23510,Mini Playing Cards Gymkhana,6.04,1,15492,United Kingdom
202,3/31/2020,23521,Wall Art Cat And Bird,6.04,1,15492,United Kingdom
203,4/1/2020,23526,Wall Art Dog Licence,6.04,4,15492,United Kingdom
204,4/2/2020,23530,Wall Art Only One Person,6.04,2,15492,United Kingdom
205,4/3/2020,23534,Wall Art Stop For Tea,6.19,6,15492,United Kingdom
206,4/4/2020,23535,Wall Art Bicycle Safety,6.19,4,15492,United Kingdom
207,4/5/2020,23536,Wall Art Village Show,6.19,1,15492,United Kingdom
208,4/6/2020,23538,Wall Art Vintage Heart,6.19,1,15492,United Kingdom
209,4/7/2020,23551,Pack Of 12 Paisley Park Tissues,6.19,1,15492,United Kingdom
210,4/8/2020,23552,Bicycle Puncture Repair Kit,6.19,12,15492,United Kingdom
211,4/9/2020,23555,Landmark Frame Notting Hill,6.19,1,15492,United Kingdom
212,4/10/2020,23559,Woodland Bunnies Lolly Makers,6.19,5,15492,United Kingdom
213,4/11/2020,23561,Set Of 6 Ribbons Party,6.19,1,15492,United Kingdom
214,4/12/2020,23564,Egg Cup Milkmaid Ingrid,6.19,2,15492,United Kingdom
215,4/13/2020,23565,Egg Cup Milkmaid Helga,6.19,2,15492,United Kingdom
216,4/14/2020,23567,Egg Cup Henrietta Hen Pink,6.19,1,15492,United Kingdom
217,4/15/2020,23569,Tradtional Alphabet Stamp Set,6.19,2,15492,United Kingdom
218,4/16/2020,23570,Traditional Pick Up Sticks Game,6.19,7,15492,United Kingdom
219,4/17/2020,23571,Traditional Naughts & Crosses,6.19,2,15492,United Kingdom
220,4/18/2020,23575,Snack Tray Paisley Park,6.19,3,15492,United Kingdom
221,4/19/2020,23579,Snack Tray I Love London,6.19,1,15492,United Kingdom
222,4/20/2020,23611,Set 10 Cards Red Riding Hood 17214,6.19,3,15492,United Kingdom
223,4/21/2020,23616,Set 10 Cards Jingle Bells 17217,6.19,1,15492,United Kingdom
224,4/22/2020,23621,Set 10 Cards David's Madonna 17074,6.19,3,15492,United Kingdom
225,4/23/2020,23635,Set 10 Cards Christmas Holly 17259,6.19,1,15492,United Kingdom
226,4/24/2020,23644,Set 10 Cards Christmas Tree 16955,6.19,1,15492,United Kingdom
227,4/25/2020,23660,Henrietta Hen Mug,6.19,1,15492,United Kingdom
228,4/26/2020,23661,Milk Maids Mug,6.19,1,15492,United Kingdom
229,4/27/2020,35095A,Blue Victorian Fabric Oval Box,6.19,1,15492,United Kingdom
230,4/28/2020,35095B,Red Victorian Fabric Oval Box,6.19,1,15492,United Kingdom
231,4/29/2020,35646,Vintage Bead Pink Evening Bag,6.19,1,15492,United Kingdom
232,4/30/2020,35648,Vintage Bead Pink Purse,6.19,2,15492,United Kingdom
233,5/1/2020,35953,Folkart Star Christmas Decorations,6.19,12,15492,United Kingdom
234,5/2/2020,35964,Folkart Clip On Stars,6.19,4,15492,United Kingdom
235,5/3/2020,35970,Zinc Folkart Sleigh Bells,6.04,1,15492,United Kingdom
236,5/4/2020,46118,Funky Monkey Cushion Cover,6.19,1,15492,United Kingdom
237,5/5/2020,46776A,Woven Bubble Gum Cushion Cover,7.24,2,15492,United Kingdom
238,5/6/2020,46776B,Woven Berries Cushion Cover,7.24,3,15492,United Kingdom
239,5/7/2020,46776C,Woven Frost Cushion Cover,7.24,1,15492,United Kingdom
240,5/8/2020,46776D,Woven Sunset Cushion Cover,7.24,2,15492,United Kingdom
241,5/9/2020,46776E,Woven Candy Cushion Cover,7.24,5,15492,United Kingdom
242,5/10/2020,46776F,Woven Rose Garden Cushion Cover,7.24,6,15492,United Kingdom
243,5/11/2020,47310M,Small Pop Box Funky Monkey,6.19,1,15492,United Kingdom
244,5/12/2020,47480,Hanging Photo Clip Rope Ladder,6.19,3,15492,United Kingdom
245,5/13/2020,47504H,English Rose Spirit Level,7.24,1,15492,United Kingdom
246,5/14/2020,47559B,Tea Time Oven Glove,7.24,3,15492,United Kingdom
247,5/15/2020,47563A,Retro Longboard Ironing Board Cover,7.24,2,15492,United Kingdom
248,5/16/2020,47566,Party Bunting,7.24,2,15492,United Kingdom
249,5/17/2020,47590B,Pink Happy Birthday Bunting,7.24,1,15492,United Kingdom
250,5/18/2020,51014A,Feather Pen Hot Pink,7.24,2,15492,United Kingdom
251,5/19/2020,51014L,Feather Pen Light Pink,7.24,1,15492,United Kingdom
252,5/20/2020,71270,Photo Clip Line,7.24,1,15492,United Kingdom
253,5/21/2020,72349B,Set/6 Purple Butterfly T-Lights,6.39,1,15492,United Kingdom
254,5/22/2020,72741,Grand Chocolatecandle,7.24,3,15492,United Kingdom
255,5/23/2020,72800E,4 Ivory Dinner Candles Silver Flock,7.24,3,15492,United Kingdom
256,5/24/2020,79321,Chilli Lights,6.19,1,15492,United Kingdom
257,5/25/2020,82484,Wood Black Board Ant White Finish,6.19,2,15492,United Kingdom
258,5/26/2020,82567,Airline Lounge Metal Sign,6.19,2,15492,United Kingdom
259,5/27/2020,82582,Area Patrolled Metal Sign,6.19,1,15492,United Kingdom
260,5/28/2020,82600,N0 Singing Metal Sign,6.19,1,15492,United Kingdom
261,5/29/2020,84031A,Charlie+Lola Red Hot Water Bottle,6.19,4,15492,United Kingdom
262,5/30/2020,84077,World War 2 Gliders Asstd Designs,6.19,1,15492,United Kingdom
263,5/31/2020,84249A,Greeting Card Square Doughnuts,6.19,1,15492,United Kingdom
264,6/1/2020,84347,Rotating Silver Angels T-Light Hldr,6.19,2,15492,United Kingdom
265,6/2/2020,84375,Set Of 20 Kids Cookie Cutters,6.19,1,15492,United Kingdom
266,6/3/2020,84378,Set Of 3 Heart Cookie Cutters,6.19,4,15492,United Kingdom
267,6/4/2020,84519B,Carrot Charlie+Lola Coaster Set,6.19,1,15492,United Kingdom
268,6/5/2020,84559A,3d Sheet Of Dog Stickers,6.19,2,15492,United Kingdom
269,6/6/2020,84568,Girls Alphabet Iron On Patches,6.19,31,15492,United Kingdom
270,6/7/2020,84569D,Pack 6 Heart/Ice-Cream Patches,6.19,1,15492,United Kingdom
271,6/8/2020,84596B,Small Dolly Mix Design Orange Bowl,6.19,4,15492,United Kingdom
272,6/9/2020,84596F,Small Marshmallows Pink Bowl,6.19,4,15492,United Kingdom
273,6/10/2020,84598,Boys Alphabet Iron On Patches,6.19,5,15492,United Kingdom
274,6/11/2020,84692,Box Of 24 Cocktail Parasols,6.19,1,15492,United Kingdom
275,6/12/2020,84755,Colour Glass T-Light Holder Hanging,6.19,4,15492,United Kingdom
276,6/13/2020,84828,Jungle Popsicles Ice Lolly Moulds,6.19,1,15492,United Kingdom
277,6/14/2020,84879,Assorted Colour Bird Ornament,6.19,16,15492,United Kingdom
278,6/15/2020,84923,Pink Butterfly Handbag W Bobbles,6.04,3,15492,United Kingdom
279,6/16/2020,84946,Antique Silver T-Light Glass,6.04,18,15492,United Kingdom
280,6/17/2020,84970S,Hanging Heart Zinc T-Light Holder,6.04,3,15492,United Kingdom
281,6/18/2020,84978,Hanging Heart Jar T-Light Holder,6.04,4,15492,United Kingdom
282,6/19/2020,84991,60 Teatime Fairy Cake Cases,6.04,1,15492,United Kingdom
283,6/20/2020,84997A,Childrens Cutlery Polkadot Green,6.04,1,15492,United Kingdom
284,6/21/2020,84997B,Childrens Cutlery Retrospot Red,6.04,1,15492,United Kingdom
285,6/22/2020,20733,Gold Mini Tape Measure,6.04,3,15492,United Kingdom
286,6/23/2020,20777,Chrysanthemum Notebook,6.19,2,15492,United Kingdom
287,6/24/2020,20782,Camouflage Ear Muff Headphones,6.19,1,15492,United Kingdom
288,6/25/2020,20914,Set/5 Red Retrospot Lid Glass Bowls,6.19,2,15492,United Kingdom
289,6/26/2020,20931,Blue Pot Plant Candle,6.19,1,15492,United Kingdom
290,6/27/2020,20970,Pink Floral Feltcraft Shoulder Bag,6.19,1,15492,United Kingdom
291,6/28/2020,20971,Pink Blue Felt Craft Trinket Box,6.19,2,15492,United Kingdom
292,6/29/2020,20972,Pink Cream Felt Craft Trinket Box,6.19,3,15492,United Kingdom
293,6/30/2020,20973,12 Pencil Small Tube Woodland,6.19,4,15492,United Kingdom
294,7/1/2020,20978,36 Pencils Tube Skulls,6.19,1,15492,United Kingdom
295,7/2/2020,20979,36 Pencils Tube Red Retrospot,6.19,3,15492,United Kingdom
296,7/3/2020,20982,12 Pencils Tall Tube Skulls,6.19,2,15492,United Kingdom
297,7/4/2020,20983,12 Pencils Tall Tube Red Retrospot,6.19,4,15492,United Kingdom
298,7/5/2020,20985,Heart Calculator,6.19,1,15492,United Kingdom
299,7/6/2020,20986,Blue Calculator Ruler,6.19,1,15492,United Kingdom
300,7/7/2020,21000,Rose Du Sud Cosmetics Bag,6.19,1,15492,United Kingdom
301,7/8/2020,21012,Antique All Glass Candlestick,6.19,3,15492,United Kingdom
302,7/9/2020,21015,Dark Bird House Tree Decoration,6.19,8,15492,United Kingdom
303,7/10/2020,21026,Space Owl,6.19,1,15492,United Kingdom
304,7/11/2020,21035,Set/2 Red Retrospot Tea Towels,6.19,1,15492,United Kingdom
305,7/12/2020,21064,Boom Box Speaker Boys,6.19,4,15492,United Kingdom
306,7/13/2020,21065,Boom Box Speaker Girls,6.19,2,15492,United Kingdom
307,7/14/2020,21098,Christmas Toilet Roll,6.19,1,15492,United Kingdom
308,7/15/2020,21123,Set/10 Ivory Polkadot Party Candles,6.19,1,15492,United Kingdom
309,7/16/2020,21125,Set 6 Football Celebration Candles,6.19,1,15492,United Kingdom
310,7/17/2020,21126,Set Of 6 Girls Celebration Candles,6.19,1,15492,United Kingdom
311,7/18/2020,21137,Black Record Cover Frame,6.19,17,15492,United Kingdom
312,7/19/2020,21154,Red Retrospot Oven Glove,6.19,2,15492,United Kingdom
313,7/20/2020,21158,Moody Girl Door Hanger,6.19,1,15492,United Kingdom
314,7/21/2020,21162,Toxic Area Door Hanger,6.19,1,15492,United Kingdom
315,7/22/2020,21166,Cook With Wine Metal Sign,6.19,2,15492,United Kingdom
316,7/23/2020,21172,Party Metal Sign,6.19,1,15492,United Kingdom
317,7/24/2020,21174,Pottering In The Shed Metal Sign,6.19,2,15492,United Kingdom
318,7/25/2020,21175,Gin And Tonic Diet Metal Sign,6.19,2,15492,United Kingdom
319,7/26/2020,21200,Multicolour Honeycomb Paper Garland,6.04,6,15492,United Kingdom
320,7/27/2020,21201,Tropical Honeycomb Paper Garland,6.04,4,15492,United Kingdom
321,7/28/2020,21212,Pack Of 72 Retrospot Cake Cases,6.04,2,15492,United Kingdom
322,7/29/2020,21213,Pack Of 72 Skull Cake Cases,6.04,2,15492,United Kingdom
323,7/30/2020,21220,Set/4 Badges Dogs,6.19,2,15492,United Kingdom
324,7/31/2020,21224,Set/4 Skull Badges,6.19,1,15492,United Kingdom
325,8/1/2020,21232,Strawberry Ceramic Trinket Pot,6.19,1,15492,United Kingdom
326,8/2/2020,21257,Victorian Sewing Box Medium,6.19,2,15492,United Kingdom
327,8/3/2020,21258,Victorian Sewing Box Large,6.19,1,15492,United Kingdom
328,8/4/2020,21259,Victorian Sewing Box Small,6.19,1,15492,United Kingdom
329,8/5/2020,21313,Glass Heart T-Light Holder,6.19,1,15492,United Kingdom
330,8/6/2020,21314,Small Glass Heart Trinket Pot,6.19,2,15492,United Kingdom
331,8/7/2020,21328,Balloons Writing Set,6.19,2,15492,United Kingdom
332,8/8/2020,21329,Dinosaurs Writing Set,6.19,2,15492,United Kingdom
333,8/9/2020,21356,Toast Its - Fairy Flower,6.19,16,15492,United Kingdom
334,8/10/2020,21378,Small Tall Camphor Wood Toadstool,6.19,2,15492,United Kingdom
335,8/11/2020,21379,Camphor Wood Portobello Mushroom,6.19,1,15492,United Kingdom
336,8/12/2020,21383,Pack Of 12 Sticky Bunnies,6.19,1,15492,United Kingdom
337,8/13/2020,21402,Red Egg Spoon,6.19,1,15492,United Kingdom
338,8/14/2020,21408,Spotty Pink Duck Doorstop,6.19,2,15492,United Kingdom
339,8/15/2020,21411,Gingham Heart Doorstop Red,6.19,1,15492,United Kingdom
340,8/16/2020,21467,Cherry Crochet Food Cover,6.19,1,15492,United Kingdom
