TransactionNo,Date,ProductNo,ProductName,Price,Quantity,CustomerNo,Country
341,8/17/2020,21471,Strawberry Raffia Food Cover,6.19,2,15492,United Kingdom
342,8/18/2020,21479,White Skull Hot Water Bottle,6.19,2,15492,United Kingdom
343,8/19/2020,21481,Fawn Blue Hot Water Bottle,6.19,3,15492,United Kingdom
344,8/20/2020,21484,Chick Grey Hot Water Bottle,6.19,1,15492,United Kingdom
345,8/21/2020,21485,Retrospot Heart Hot Water Bottle,6.19,1,15492,United Kingdom
346,8/22/2020,21494,Rotating Leaves T-Light Holder,6.19,11,15492,United Kingdom
347,8/23/2020,21506,Fancy Font Birthday Card,6.19,3,15492,United Kingdom
348,8/24/2020,21507,Elephant Birthday Card,7.24,1,15492,United Kingdom
349,8/25/2020,21508,Vintage Kid Dolly Card,7.24,1,15492,United Kingdom
350,8/26/2020,21509,Cowboys And Indians Birthday Card,7.24,2,15492,United Kingdom
351,8/27/2020,21528,Dairy Maid Traditional Teapot,7.24,1,15492,United Kingdom
352,8/28/2020,21544,Skulls Water Transfer Tattoos,7.24,2,15492,United Kingdom
353,8/29/2020,21558,Skull Lunch Box With Cutlery,6.39,1,15492,United Kingdom
354,8/30/2020,21559,Strawberry Lunch Box With Cutlery,7.24,1,15492,United Kingdom
355,8/31/2020,21615,4 Lavender Botanical Dinner Candles,7.24,2,15492,United Kingdom
356,9/1/2020,21616,4 Pear Botanical Dinner Candles,7.24,6,15492,United Kingdom
357,9/2/2020,21620,Set Of 4 Rose Botanical Candles,7.24,5,15492,United Kingdom
358,9/3/2020,21642,Assorted Tutti Frutti Pen,7.24,4,15492,United Kingdom
359,9/4/2020,21648,Assorted Tutti Frutti Small Purse,7.24,2,15492,United Kingdom
360,9/5/2020,21650,Assorted Tutti Frutti Bracelet,7.24,14,15492,United Kingdom
361,9/6/2020,21675,Butterflies Stickers,6.19,2,15492,United Kingdom
362,9/7/2020,21677,Hearts Stickers,6.19,1,15492,United Kingdom
363,9/8/2020,21678,Paisley Pattern Stickers,6.19,2,15492,United Kingdom
364,9/9/2020,21680,Woodland Stickers,6.19,1,15492,United Kingdom
365,9/10/2020,21703,Bag 125g Swirly Marbles,6.19,1,15492,United Kingdom
366,9/11/2020,21704,Bag 250g Swirly Marbles,6.19,1,15492,United Kingdom
367,9/12/2020,21716,Boys Vintage Tin Seaside Bucket,6.19,1,15492,United Kingdom
368,9/13/2020,21718,Red Metal Beach Spade,6.19,1,15492,United Kingdom
369,9/14/2020,21724,Panda And Bunnies Sticker Sheet,6.19,1,15492,United Kingdom
370,9/15/2020,21731,Red Toadstool Led Night Light,6.19,6,15492,United Kingdom
371,9/16/2020,21739,Cosy Slipper Shoes Small Green,6.19,2,15492,United Kingdom
372,9/17/2020,21774,Decorative Cats Bathroom Bottle,6.19,1,15492,United Kingdom
373,9/18/2020,21786,Polkadot Rain Hat,6.19,3,15492,United Kingdom
374,9/19/2020,21787,Rain Poncho Retrospot,6.19,2,15492,United Kingdom
375,9/20/2020,21790,Vintage Snap Cards,6.19,5,15492,United Kingdom
376,9/21/2020,21791,Vintage Heads And Tails Card Game,6.19,1,15492,United Kingdom
377,9/22/2020,21808,Christmas Garland Stars Trees,6.19,3,15492,United Kingdom
378,9/23/2020,21810,Christmas Hanging Star With Bell,6.19,25,15492,United Kingdom
379,9/24/2020,21812,Garland With Hearts And Bells,6.19,7,15492,United Kingdom
380,9/25/2020,21813,Garland With Stars And Bells,6.19,3,15492,United Kingdom
381,9/26/2020,21822,Glitter Christmas Tree With Bells,6.19,12,15492,United Kingdom
382,9/27/2020,21828,Eight Piece Snake Set,6.19,1,15492,United Kingdom
383,9/28/2020,21832,Chocolate Calculator,6.19,1,15492,United Kingdom
384,9/29/2020,21833,Camouflage Led Torch,6.04,2,15492,United Kingdom
385,9/30/2020,21871,Save The Planet Mug,6.19,1,15492,United Kingdom
386,10/1/2020,21874,Gin And Tonic Mug,6.19,2,15492,United Kingdom
387,10/2/2020,21876,Pottering Mug,6.19,4,15492,United Kingdom
388,10/3/2020,21879,Hearts Gift Tape,6.19,1,15492,United Kingdom
389,10/4/2020,21889,Wooden Box Of Dominoes,6.19,3,15492,United Kingdom
390,10/5/2020,21890,S/6 Wooden Skittles In Cotton Bag,6.19,1,15492,United Kingdom
391,10/6/2020,21892,Traditional Wooden Catch Cup Game,6.19,1,15492,United Kingdom
392,10/7/2020,21900,Key Fob Shed,6.19,4,15492,United Kingdom
393,10/8/2020,21901,Key Fob Back Door,6.19,2,15492,United Kingdom
394,10/9/2020,21902,Key Fob Front Door,6.19,1,15492,United Kingdom
395,10/10/2020,21905,More Butter Metal Sign,6.19,1,15492,United Kingdom
396,10/11/2020,21906,Pharmacie First Aid Tin,6.19,1,15492,United Kingdom
397,10/12/2020,21914,Blue Harmonica In Box,6.19,2,15492,United Kingdom
398,10/13/2020,21916,Set 12 Retro White Chalk Sticks,6.19,2,15492,United Kingdom
399,10/14/2020,21930,Jumbo Storage Bag Skulls,6.19,1,15492,United Kingdom
400,10/15/2020,21931,Jumbo Storage Bag Suki,6.19,1,15492,United Kingdom
401,10/16/2020,21932,Scandinavian Paisley Picnic Bag,6.19,1,15492,United Kingdom
402,10/17/2020,21934,Skull Shoulder Bag,6.19,3,15492,United Kingdom
403,10/18/2020,21935,Suki Shoulder Bag,6.19,9,15492,United Kingdom
404,10/19/2020,21936,Red Retrospot Picnic Bag,6.19,1,15492,United Kingdom
405,10/20/2020,21942,Skulls Design Flannel,6.19,2,15492,United Kingdom
406,10/21/2020,21945,Strawberries Design Flannel,6.19,2,15492,United Kingdom
407,10/22/2020,21947,Set Of 6 Heart Chopsticks,6.19,1,15492,United Kingdom
408,10/23/2020,21949,Set Of 6 Strawberry Chopsticks,6.19,2,15492,United Kingdom
409,10/24/2020,21967,Pack Of 12 Skull Tissues,6.19,1,15492,United Kingdom
410,10/25/2020,21976,Pack Of 60 Mushroom Cake Cases,6.19,3,15492,United Kingdom
411,10/26/2020,21977,Pack Of 60 Pink Paisley Cake Cases,6.19,2,15492,United Kingdom
412,10/27/2020,21980,Pack Of 12 Red Retrospot Tissues,6.19,2,15492,United Kingdom
413,10/28/2020,21981,Pack Of 12 Woodland Tissues,6.19,4,15492,United Kingdom
414,10/29/2020,21982,Pack Of 12 Suki Tissues,6.19,2,15492,United Kingdom
415,10/30/2020,21983,Pack Of 12 Blue Paisley Tissues,6.19,1,15492,United Kingdom
416,10/31/2020,21984,Pack Of 12 Pink Paisley Tissues,6.19,1,15492,United Kingdom
417,11/1/2020,21986,Pack Of 12 Pink Polkadot Tissues,6.19,3,15492,United Kingdom
418,11/2/2020,21989,Pack Of 20 Skull Paper Napkins,6.19,2,15492,United Kingdom
419,11/3/2020,21990,Modern Floral Stationery Set,6.19,8,15492,United Kingdom
420,11/4/2020,21993,Floral Folk Stationery Set,6.19,8,15492,United Kingdom
421,11/5/2020,22024,Rainy Ladies Birthday Card,6.19,3,15492,United Kingdom
422,11/6/2020,22025,Ring Of Roses Birthday Card,6.19,3,15492,United Kingdom
423,11/7/2020,22026,Banquet Birthday Card,6.19,4,15492,United Kingdom
424,11/8/2020,22027,Tea Party Birthday Card,6.19,2,15492,United Kingdom
425,11/9/2020,22028,Penny Farthing Birthday Card,6.19,1,15492,United Kingdom
426,11/10/2020,22029,Spaceboy Birthday Card,6.19,4,15492,United Kingdom
427,11/11/2020,22031,Botanical Lavender Birthday Card,6.19,1,15492,United Kingdom
428,11/12/2020,22037,Robot Birthday Card,6.19,4,15492,United Kingdom
429,11/13/2020,22064,Pink Doughnut Trinket Pot,6.19,1,15492,United Kingdom
430,11/14/2020,22065,Christmas Pudding Trinket Pot,6.19,2,15492,United Kingdom
431,11/15/2020,22068,Black Pirate Treasure Chest,6.19,1,15492,United Kingdom
432,11/16/2020,22070,Small Red Retrospot Mug In Box,6.19,3,15492,United Kingdom
433,11/17/2020,22071,Small White Retrospot Mug In Box,6.19,1,15492,United Kingdom
434,11/18/2020,22074,6 Ribbons Shimmering Pinks,6.19,1,15492,United Kingdom
435,11/19/2020,22075,6 Ribbons Elegant Christmas,6.19,8,15492,United Kingdom
436,11/20/2020,22076,6 Ribbons Empire,6.19,4,15492,United Kingdom
437,11/21/2020,22083,Paper Chain Kit Retrospot,6.19,1,15492,United Kingdom
438,11/22/2020,22085,Paper Chain Kit Skulls,6.19,1,15492,United Kingdom
439,11/23/2020,22086,Paper Chain Kit 50'S Christmas,6.19,38,15492,United Kingdom
440,11/24/2020,22091,Empire Tissue Box,6.19,1,15492,United Kingdom
441,11/25/2020,22099,Caravan Square Tissue Box,6.19,3,15492,United Kingdom
442,11/26/2020,22104,Mirror Mosaic Candle Plate,6.19,4,15492,United Kingdom
443,11/27/2020,22106,Mirror Mosaic Hurricane Lamp,6.19,1,15492,United Kingdom
444,11/28/2020,22107,Pizza Plate In Box,6.19,10,15492,United Kingdom
445,11/29/2020,22108,Ping! Microwave Plate,6.04,2,15492,United Kingdom
446,11/30/2020,22109,Full English Breakfast Plate,6.04,2,15492,United Kingdom
447,12/1/2020,22110,Bird House Hot Water Bottle,6.04,3,15492,United Kingdom
448,12/2/2020,22111,Scottie Dog Hot Water Bottle,6.19,1,15492,United Kingdom
449,12/3/2020,22112,Chocolate Hot Water Bottle,6.19,1,15492,United Kingdom
450,12/4/2020,22114,Hot Water Bottle Tea And Sympathy,6.19,4,15492,United Kingdom
451,12/5/2020,22116,Metal Sign His Dinner Is Served,6.19,2,15492,United Kingdom
452,12/6/2020,22121,Noel Wooden Block Letters,6.19,1,15492,United Kingdom
453,12/7/2020,22123,Ping Microwave Apron,6.19,1,15492,United Kingdom
454,12/8/2020,22124,Set Of 2 Tea Towels Ping Microwave,6.19,1,15492,United Kingdom
455,12/9/2020,22129,Party Cones Candy Decoration,6.19,3,15492,United Kingdom
456,12/10/2020,22134,Mini Ladle Love Heart Red,6.19,1,15492,United Kingdom
457,12/11/2020,15036,Assorted Colours Silk Fan,6.19,1,15492,United Kingdom
458,12/12/2020,15039,Sandalwood Fan,6.19,1,15492,United Kingdom
459,12/13/2020,15058C,Ice Cream Design Garden Parasol,6.19,1,15492,United Kingdom
460,12/14/2020,16218,Cartoon Pencil Sharpeners,6.19,5,15492,United Kingdom
461,12/15/2020,16225,Rattle Snake Eggs,6.19,1,15492,United Kingdom
462,12/16/2020,16235,Recycled Pencil With Rabbit Eraser,6.19,3,15492,United Kingdom
463,12/17/2020,16237,Sleeping Cat Erasers,6.19,1,15492,United Kingdom
464,12/18/2020,17038,Porcelain Budah Incense Holder,6.19,1,15492,United Kingdom
465,12/19/2020,17084N,Fairy Dreams Incense,6.19,1,15492,United Kingdom
466,12/20/2020,20659,Economy Luggage Tag,6.19,7,15492,United Kingdom
467,12/21/2020,20665,Red Retrospot Purse,6.19,2,15492,United Kingdom
468,12/22/2020,20668,Disco Ball Christmas Decoration,6.19,1,15492,United Kingdom
469,12/23/2020,20718,Red Retrospot Shopper Bag,6.19,1,15492,United Kingdom
470,12/24/2020,20719,Woodland Charlotte Bag,6.19,7,15492,United Kingdom
471,12/25/2020,20723,Strawberry Charlotte Bag,6.19,2,15492,United Kingdom
472,12/26/2020,20724,Red Retrospot Charlotte Bag,6.19,4,15492,United Kingdom
473,12/27/2020,22135,Mini Ladle Love Heart Pink,6.19,6,15492,United Kingdom
474,12/28/2020,22138,Baking Set 9 Piece Retrospot,6.19,1,15492,United Kingdom
475,12/29/2020,22141,Christmas Craft Tree Top Angel,6.19,2,15492,United Kingdom
476,12/30/2020,22150,3 Stripey Mice Feltcraft,7.24,2,15492,United Kingdom
477,12/31/2020,22153,Angel Decoration Stars On Dress,7.24,2,15492,United Kingdom
478,1/1/2021,22154,Angel Decoration 3 Buttons,7.24,3,15492,United Kingdom
479,1/2/2021,22155,Star Decoration Rustic,7.24,7,15492,United Kingdom
480,1/3/2021,22156,Heart Decoration With Pearls,7.24,4,15492,United Kingdom
481,1/4/2021,22163,Heart String Memo Holder Hanging,7.24,9,15492,United Kingdom
482,1/5/2021,22165,Diamante Heart Shaped Wall Mirror,7.24,1,15492,United Kingdom
483,1/6/2021,22167,Oval Wall Mirror Diamante,7.24,1,15492,United Kingdom
484,1/7/2021,22170,Picture Frame Wood Triple Portrait,7.24,1,15492,United Kingdom
485,1/8/2021,22173,Metal 4 Hook Hanger French Chateau,7.24,2,15492,United Kingdom
486,1/9/2021,22174,Photo Cube,6.19,7,15492,United Kingdom
487,1/10/2021,22178,Victorian Glass Hanging T-Light,6.19,5,15492,United Kingdom
488,1/11/2021,22186,Red Star Card Holder,7.24,2,15492,United Kingdom
489,1/12/2021,22190,Local Cafe Mug,7.24,3,15492,United Kingdom
490,1/13/2021,22193,Red Diner Wall Clock,7.24,1,15492,United Kingdom
491,1/14/2021,22195,Large Heart Measuring Spoons,7.24,1,15492,United Kingdom
492,1/15/2021,22196,Small Heart Measuring Spoons,7.24,11,15492,United Kingdom
493,1/16/2021,22197,Popcorn Holder,7.24,34,15492,United Kingdom
494,1/17/2021,22199,Frying Pan Red Retrospot,7.24,1,15492,United Kingdom
495,1/18/2021,22209,Wood Stamp Set Happy Birthday,7.24,1,15492,United Kingdom
496,1/19/2021,22212,Four Hook White Lovebirds,7.24,1,15492,United Kingdom
497,1/20/2021,22219,Lovebird Hanging Decoration White,7.24,4,15492,United Kingdom
498,1/21/2021,22224,White Lovebird Lantern,7.24,4,15492,United Kingdom
499,1/22/2021,22227,Hanging Heart Mirror Decoration,7.24,1,15492,United Kingdom
500,1/23/2021,22260,Felt Egg Cosy Blue Rabbit,6.39,2,15492,United Kingdom
501,1/24/2021,22261,Felt Egg Cosy White Rabbit,7.24,1,15492,United Kingdom
502,1/25/2021,22264,Felt Farm Animal White Bunny,7.24,1,15492,United Kingdom
503,1/26/2021,22273,Feltcraft Doll Molly,7.24,2,15492,United Kingdom
504,1/27/2021,22277,Cosmetic Bag Vintage Rose Paisley,7.24,1,15492,United Kingdom
505,1/28/2021,22279,Pocket Bag Blue Paisley Red Spot,7.24,5,15492,United Kingdom
506,1/29/2021,22280,Pocket Bag Pink Paisely Brown Spot,7.24,4,15492,United Kingdom
507,1/30/2021,22300,Coffee Mug Dog + Ball Design,7.24,1,15492,United Kingdom
508,1/31/2021,22301,Coffee Mug Cat + Bird Design,7.24,1,15492,United Kingdom
509,2/1/2021,22307,Gold Mug Bone China Tree Of Life,7.24,1,15492,United Kingdom
510,2/2/2021,22308,Tea Cosy Blue Stripe,7.24,2,15492,United Kingdom
511,2/3/2021,22309,Tea Cosy Red Stripe,7.24,2,15492,United Kingdom
512,2/4/2021,22324,Blue Polkadot Kids Bag,7.24,2,15492,United Kingdom
513,2/5/2021,22326,Round Snack Boxes Set Of4 Woodland,7.24,3,15492,United Kingdom
514,2/6/2021,22327,Round Snack Boxes Set Of 4 Skulls,7.24,2,15492,United Kingdom
515,2/7/2021,22329,Round Container Set Of 5 Retrospot,6.19,2,15492,United Kingdom
516,2/8/2021,22338,Star Decoration Painted Zinc,6.19,4,15492,United Kingdom
517,2/9/2021,22340,Noel Garland Painted Zinc,6.19,17,15492,United Kingdom
518,2/10/2021,22342,Home Garland Painted Zinc,6.19,7,15492,United Kingdom
519,2/11/2021,22348,Tea Bag Plate Red Retrospot,6.19,3,15492,United Kingdom
520,2/12/2021,22355,Charlotte Bag Suki Design,6.19,3,15492,United Kingdom
521,2/13/2021,22356,Charlotte Bag Pink Polkadot,6.19,1,15492,United Kingdom
522,2/14/2021,22357,Kings Choice Biscuit Tin,6.19,2,15492,United Kingdom
523,2/15/2021,22358,Kings Choice Tea Caddy,6.19,1,15492,United Kingdom
524,2/16/2021,22361,Glass Jar Daisy Fresh Cotton Wool,6.19,2,15492,United Kingdom
525,2/17/2021,22362,Glass Jar Peacock Bath Salts,6.19,2,15492,United Kingdom
526,2/18/2021,22367,Childrens Apron Spaceboy Design,6.19,1,15492,United Kingdom
527,2/19/2021,22372,Airline Bag Vintage World Champion,6.19,1,15492,United Kingdom
528,2/20/2021,22374,Airline Bag Vintage Jet Set Red,6.19,1,15492,United Kingdom
529,2/21/2021,85014B,Red Retrospot Umbrella,6.19,1,15492,United Kingdom
530,2/22/2021,85032C,Curious Images Gift Wrap Set,6.19,1,15492,United Kingdom
531,2/23/2021,85038,6 Chocolate Love Heart T-Lights,6.19,1,15492,United Kingdom
532,2/24/2021,85039A,Set/4 Red Mini Rose Candle In Bowl,6.19,5,15492,United Kingdom
533,2/25/2021,85039B,S/4 Ivory Mini Rose Candle In Bowl,6.19,4,15492,United Kingdom
534,2/26/2021,85040A,S/4 Pink Flower Candles In Bowl,6.19,1,15492,United Kingdom
535,2/27/2021,85048,15cm Christmas Glass Ball 20 Lights,6.19,2,15492,United Kingdom
536,2/28/2021,85049C,Romantic Pinks Ribbons,6.19,1,15492,United Kingdom
537,3/1/2021,85049G,Chocolate Box Ribbons,6.19,1,15492,United Kingdom
538,3/2/2021,85049H,Urban Black Ribbons,6.19,2,15492,United Kingdom
539,3/3/2021,85053,French Enamel Candleholder,6.19,1,15492,United Kingdom
540,3/4/2021,85059,French Enamel Water Basin,6.19,1,15492,United Kingdom
541,3/5/2021,85066,Cream Sweetheart Mini Chest,6.19,1,15492,United Kingdom
542,3/6/2021,85094,Candy Spot Egg Warmer Rabbit,6.19,2,15492,United Kingdom
543,3/7/2021,85114C,Red Enchanted Forest Placemat,6.19,1,15492,United Kingdom
544,3/8/2021,85123A,Cream Hanging Heart T-Light Holder,6.19,3,15492,United Kingdom
545,3/9/2021,85131B,Beaded Crystal Heart Green On Stick,6.19,1,15492,United Kingdom
546,3/10/2021,85131D,Beaded Crystal Heart Pink On Stick,6.19,2,15492,United Kingdom
547,3/11/2021,85152,Hand Over The Chocolate Sign,6.19,1,15492,United Kingdom
548,3/12/2021,85168B,Black Baroque Carriage Clock,6.19,3,15492,United Kingdom
549,3/13/2021,85169C,Eau De Nil Love Bird Candle,6.19,1,15492,United Kingdom
550,3/14/2021,85170C,Set/6 Eau De Nil Bird T-Lights,6.19,1,15492,United Kingdom
551,3/15/2021,85173,Set/6 Frog Prince T-Light Candles,6.19,1,15492,United Kingdom
552,3/16/2021,85177,Basket Of Flowers Sewing Kit,6.19,1,15492,United Kingdom
553,3/17/2021,85178,Victorian Sewing Kit,6.19,1,15492,United Kingdom
554,3/18/2021,85179A,Green Bitty Light Chain,6.19,4,15492,United Kingdom
555,3/19/2021,85199S,Small Hanging Ivory/Red Wood Bird,6.19,9,15492,United Kingdom
556,3/20/2021,85227,Set Of 6 3d Kit Cards For Kids,6.19,3,15492,United Kingdom
557,3/21/2021,90003C,Midnight Blue Pair Heart Hair Slide,6.19,1,15492,United Kingdom
558,3/22/2021,90003E,Green Pair Heart Hair Slides,6.19,2,15492,United Kingdom
559,3/23/2021,90010A,Midnight Blue Glass/Silver Bracelet,6.04,1,15492,United Kingdom
560,3/24/2021,90013A,Midnight Blue Vintage Earrings,6.19,3,15492,United Kingdom
561,3/25/2021,90013C,Green Vintage Earrings,6.19,2,15492,United Kingdom
562,3/26/2021,90014A,Silver Mop Orbit Necklace,6.19,1,15492,United Kingdom
563,3/27/2021,90016B,Gold/Mop Pendant Orbit Necklace,6.19,1,15492,United Kingdom
564,3/28/2021,90018B,Gold Mop Orbit Drop Earrings,6.19,1,15492,United Kingdom
565,3/29/2021,90019B,Gold Mop Orbit Bracelet,6.19,1,15492,United Kingdom
566,3/30/2021,90027D,Glass Bead Hoop Earrings Amethyst,6.19,1,15492,United Kingdom
567,3/31/2021,90030B,Red Kukui Coconut Seed Necklace,6.19,1,15492,United Kingdom
568,4/1/2021,90055,Cracked Glaze Earrings Brown,6.19,1,15492,United Kingdom
569,4/2/2021,90059A,Diamante Hair Grip Pack/2 Crystal,6.19,1,15492,United Kingdom
570,4/3/2021,90059D,Diamante Hair Grip Pack/2 Peridot,6.19,2,15492,United Kingdom
571,4/4/2021,90059E,Diamante Hair Grip Pack/2 Ruby,6.04,1,15492,United Kingdom
572,4/5/2021,90059F,Diamante Hair Grip Pack/2 Lt Rose,6.19,1,15492,United Kingdom
573,4/6/2021,90072,Ruby Drop Chandelier Earrings,6.19,1,15492,United Kingdom
574,4/7/2021,90086,Crystal Frog Phone Charm,6.19,1,15492,United Kingdom
575,4/8/2021,90120B,Blue Murano Twist Bracelet,6.19,2,15492,United Kingdom
576,4/9/2021,90120C,Green Murano Twist Bracelet,6.19,1,15492,United Kingdom
577,4/10/2021,90130B,Turq Stone/Crystal Earrings,6.19,1,15492,United Kingdom
578,4/11/2021,90130C,Green Stone/Crystal Earrings,6.19,1,15492,United Kingdom
579,4/12/2021,90134,Old Rose Combo Bead Necklace,6.19,1,15492,United Kingdom
580,4/13/2021,90138,White/Pink Mini Crystals Necklace,6.19,1,15492,United Kingdom
581,4/14/2021,90141B,Ivory Pendant Triple Shell Necklace,6.19,1,15492,United Kingdom
582,4/15/2021,90145,Silver Hoop Earrings With Flower,6.19,1,15492,United Kingdom
583,4/16/2021,90155,Resin Necklace W Pastel Beads,6.19,1,15492,United Kingdom
584,4/17/2021,90161D,Ant Copper Pink Boudicca Bracelet,6.19,1,15492,United Kingdom
585,4/18/2021,90163A,Pink Rosebud & Pearl Necklace,6.19,2,15492,United Kingdom
586,4/19/2021,90165B,White Rosebud Pearl Earrings,6.19,1,15492,United Kingdom
587,4/20/2021,90168,2 Daisies Hair Comb,6.19,1,15492,United Kingdom
588,4/21/2021,90169,Daisy Hair Comb,6.19,1,15492,United Kingdom
589,4/22/2021,90170,Daisy Hair Band,6.19,1,15492,United Kingdom
590,4/23/2021,90174,Butterfly Hair Band,6.19,2,15492,United Kingdom
591,4/24/2021,90175A,White Glass Chunky Charm Bracelet,6.19,2,15492,United Kingdom
592,4/25/2021,90175D,Tigris Eye Chunky Charm Bracelet,6.19,1,15492,United Kingdom
593,4/26/2021,90177A,Classic Diamante Earrings Jet,6.19,1,15492,United Kingdom
594,4/27/2021,90177C,Drop Diamante Earrings Crystal,6.19,1,15492,United Kingdom
595,4/28/2021,90181B,Amethyst Glass/Shell/Pearl Necklace,6.04,1,15492,United Kingdom
596,4/29/2021,90182C,Black 3 Bead Drop Earrings,6.19,1,15492,United Kingdom
597,4/30/2021,90183A,Amber Drop Earrings W Long Beads,6.19,2,15492,United Kingdom
598,5/1/2021,90183C,Black Drop Earrings W Long Beads,6.19,1,15492,United Kingdom
599,5/2/2021,90184C,Black Chunky Bead Bracelet W Strap,6.19,1,15492,United Kingdom
600,5/3/2021,90185B,Amethyst Diamante Expandable Ring,6.19,1,15492,United Kingdom
601,5/4/2021,90188,Drop Earrings W Flower & Leaf,6.19,2,15492,United Kingdom
602,5/5/2021,90191,Silver Lariat 40cm,6.19,2,15492,United Kingdom
603,5/6/2021,90192,Jade Drop Earrings W Filigree,6.19,1,15492,United Kingdom
604,5/7/2021,90198A,Vintage Rose Bead Bracelet Raspberr,6.19,2,15492,United Kingdom
605,5/8/2021,90200A,Purple Sweetheart Bracelet,6.19,1,15492,United Kingdom
606,5/9/2021,90201A,Purple Enamel Flower Ring,6.19,2,15492,United Kingdom
607,5/10/2021,90201B,Black Enamel Flower Ring,6.19,1,15492,United Kingdom
608,5/11/2021,90201C,Red Enamel Flower Ring,6.19,1,15492,United Kingdom
609,5/12/2021,90201D,Green Enamel Flower Ring,6.19,1,15492,United Kingdom
610,5/13/2021,90202C,Green Enamel Flower Hair Tie,6.19,1,15492,United Kingdom
611,5/14/2021,90202D,Pink Enamel Flower Hair Tie,6.19,1,15492,United Kingdom
612,5/15/2021,90206C,Crystal Diamante Star Brooch,6.19,1,15492,United Kingdom
613,5/16/2021,90208,Pair Of Pink Flower Cluster Slide,6.19,1,15492,United Kingdom
614,5/17/2021,90210A,Grey Acrylic Faceted Bangle,6.19,1,15492,United Kingdom
615,5/18/2021,22378,Wall Tidy Retrospot,6.19,2,15492,United Kingdom
616,5/19/2021,22379,Recycling Bag Retrospot,6.19,1,15492,United Kingdom
617,5/20/2021,22380,Toy Tidy Spaceboy,6.19,2,15492,United Kingdom
618,5/21/2021,22396,Magnets Pack Of 4 Retro Photo,6.19,1,15492,United Kingdom
619,5/22/2021,22411,Jumbo Shopper Vintage Red Paisley,6.19,1,15492,United Kingdom
620,5/23/2021,22418,10 Colour Spaceboy Pen,6.19,3,15492,United Kingdom
621,5/24/2021,22419,Lipstick Pen Red,6.19,3,15492,United Kingdom
622,5/25/2021,22420,Lipstick Pen Baby Pink,6.19,1,15492,United Kingdom
623,5/26/2021,22421,Lipstick Pen Fuschia,6.19,2,15492,United Kingdom
624,5/27/2021,22422,Toothpaste Tube Pen,6.19,4,15492,United Kingdom
625,5/28/2021,22437,Set Of 9 Black Skull Balloons,7.24,1,15492,United Kingdom
626,5/29/2021,22441,Grow Your Own Basil In Enamel Mug,7.24,1,15492,United Kingdom
627,5/30/2021,22446,Pin Cushion Babushka Pink,7.24,7,15492,United Kingdom
628,5/31/2021,22457,Natural Slate Heart Chalkboard,7.24,1,15492,United Kingdom
629,6/1/2021,22464,Hanging Metal Heart Lantern,7.24,1,15492,United Kingdom
630,6/2/2021,22466,Fairy Tale Cottage Night Light,7.24,1,15492,United Kingdom
631,6/3/2021,22467,Gumball Coat Rack,7.24,1,15492,United Kingdom
632,6/4/2021,22478,Birdhouse Garden Marker,7.24,1,15492,United Kingdom
633,6/5/2021,22486,Plasmatronic Lamp,7.24,1,15492,United Kingdom
634,6/6/2021,22488,Natural Slate Rectangle Chalkboard,7.24,1,15492,United Kingdom
635,6/7/2021,22489,Pack Of 12 Traditional Crayons,7.24,5,15492,United Kingdom
636,6/8/2021,22495,Set Of 2 Round Tins Camembert,7.24,1,15492,United Kingdom
637,6/9/2021,22540,Mini Jigsaw Circus Parade,7.24,1,15492,United Kingdom
638,6/10/2021,22544,Mini Jigsaw Spaceboy,7.24,1,15492,United Kingdom
639,6/11/2021,22549,Picture Dominoes,7.24,3,15492,United Kingdom
640,6/12/2021,22551,Plasters In Tin Spaceboy,7.24,2,15492,United Kingdom
641,6/13/2021,22553,Plasters In Tin Skulls,7.24,2,15492,United Kingdom
642,6/14/2021,22554,Plasters In Tin Woodland Animals,7.24,3,15492,United Kingdom
643,6/15/2021,22555,Plasters In Tin Strongman,7.24,3,15492,United Kingdom
644,6/16/2021,22557,Plasters In Tin Vintage Paisley,7.24,2,15492,United Kingdom
645,6/17/2021,22558,Clothes Pegs Retrospot Pack 24,7.24,3,15492,United Kingdom
646,6/18/2021,22560,Traditional Modelling Clay,7.24,5,15492,United Kingdom
647,6/19/2021,22565,Feltcraft Hairbands Pink And White,7.24,4,15492,United Kingdom
648,6/20/2021,22566,Feltcraft Hairband Pink And Purple,7.24,3,15492,United Kingdom
649,6/21/2021,22571,Rocking Horse Red Christmas,7.24,4,15492,United Kingdom
650,6/22/2021,22573,Star Wooden Christmas Decoration,6.39,2,15492,United Kingdom
651,6/23/2021,22574,Heart Wooden Christmas Decoration,7.24,5,15492,United Kingdom
652,6/24/2021,22576,Swallow Wooden Christmas Decoration,7.24,3,15492,United Kingdom
653,6/25/2021,22577,Wooden Heart Christmas Scandinavian,7.24,4,15492,United Kingdom
654,6/26/2021,22578,Wooden Star Christmas Scandinavian,7.24,19,15492,United Kingdom
655,6/27/2021,22580,Advent Calendar Gingham Sack,7.24,9,15492,United Kingdom
656,6/28/2021,22581,Wood Stocking Christmas Scandispot,7.24,11,15492,United Kingdom
657,6/29/2021,22585,Pack Of 6 Birdy Gift Tags,7.24,2,15492,United Kingdom
658,6/30/2021,22586,Feltcraft Hairband Pink And Blue,7.24,2,15492,United Kingdom
659,7/1/2021,22589,Cardholder Gingham Star,7.24,6,15492,United Kingdom
660,7/2/2021,22591,Cardholder Gingham Christmas Tree,7.24,1,15492,United Kingdom
661,7/3/2021,22592,Cardholder Holly Wreath Metal,7.24,3,15492,United Kingdom
662,7/4/2021,22593,Christmas Gingham Star,6.39,2,15492,United Kingdom
663,7/5/2021,22594,Christmas Gingham Tree,7.24,3,15492,United Kingdom
664,7/6/2021,22597,Musical Zinc Heart Decoration,7.24,9,15492,United Kingdom
665,7/7/2021,22598,Christmas Musical Zinc Tree,7.24,4,15492,United Kingdom
666,7/8/2021,22599,Christmas Musical Zinc Star,6.19,5,15492,United Kingdom
667,7/9/2021,22600,Christmas Retrospot Star Wood,6.19,2,15492,United Kingdom
668,7/10/2021,22601,Christmas Retrospot Angel Wood,6.19,3,15492,United Kingdom
669,7/11/2021,22602,Retrospot Wooden Heart Decoration,6.19,3,15492,United Kingdom
670,7/12/2021,22608,Pens Assorted Funky Jeweled,6.19,3,15492,United Kingdom
671,7/13/2021,22614,Pack Of 12 Spaceboy Tissues,6.19,1,15492,United Kingdom
672,7/14/2021,22615,Pack Of 12 Circus Parade Tissues,6.19,4,15492,United Kingdom
673,7/15/2021,22616,Pack Of 12 London Tissues,6.19,1,15492,United Kingdom
674,7/16/2021,22619,Set Of 6 Soldier Skittles,6.19,4,15492,United Kingdom
675,7/17/2021,22620,4 Traditional Spinning Tops,6.19,3,15492,United Kingdom
676,7/18/2021,22621,Traditional Knitting Nancy,6.19,2,15492,United Kingdom
677,7/19/2021,22629,Spaceboy Lunch Box,6.19,1,15492,United Kingdom
